nameWithOwner,owner,url,description,primaryLanguage,stars,forks,createdAt,updatedAt,openIssues,closedIssues
hongyangAndroid/AndroidAutoLayout,hongyangAndroid,https://github.com/hongyangAndroid/AndroidAutoLayout,[停止维护]Android屏幕适配方案，直接填写设计图上的像素尺寸即可完成适配，最大限度解决适配问题。,Java,6691,1888,2015-11-19T02:09:11Z,2026-03-26T03:21:43Z,0,0
jOOQ/jOOQ,jOOQ,https://github.com/jOOQ/jOOQ,jOOQ is the best way to write SQL in Java,Java,6686,1226,2011-04-17T10:43:33Z,2026-03-25T16:01:37Z,2129,17147
Suwayomi/Suwayomi-Server,Suwayomi,https://github.com/Suwayomi/Suwayomi-Server,A rewrite of Tachiyomi for the Desktop,Java,6680,354,2020-12-23T20:31:38Z,2026-03-26T02:34:34Z,113,592
apache/storm,apache,https://github.com/apache/storm,Apache Storm,Java,6675,4050,2013-11-05T08:00:14Z,2026-03-26T03:11:52Z,40,4162
yanzhenjie/AndPermission,yanzhenjie,https://github.com/yanzhenjie/AndPermission,:strawberry: Permissions manager for Android platform.,Java,6648,1100,2016-09-11T05:17:34Z,2026-03-25T03:26:15Z,172,490
JesusFreke/smali,JesusFreke,https://github.com/JesusFreke/smali,smali/baksmali,Java,6614,1111,2012-09-23T19:51:16Z,2026-03-25T09:34:34Z,140,629
apache/zeppelin,apache,https://github.com/apache/zeppelin,"Web-based notebook that enables data-driven, interactive data analytics and collaborative documents with SQL, Scala and more.",Java,6607,2818,2015-03-25T07:00:06Z,2026-03-20T23:14:04Z,0,0
hazelcast/hazelcast,hazelcast,https://github.com/hazelcast/hazelcast,"Hazelcast is a unified real-time data platform combining stream processing with a fast data store, allowing customers to act instantly on data-in-motion for real-time insights.",Java,6604,1871,2012-03-21T12:25:18Z,2026-03-25T18:50:58Z,1097,7546
pig-mesh/pig,pig-mesh,https://github.com/pig-mesh/pig,"↥ ↥ ↥ Follow for updates An RBAC permission management system based on Spring Cloud 2025, Spring Boot 4, and OAuth2.",Java,6598,1076,2019-08-26T03:24:53Z,2026-03-26T00:18:55Z,283,592
GrenderG/Toasty,GrenderG,https://github.com/GrenderG/Toasty,"The usual Toast, but with steroids 💪",Java,6594,800,2017-01-18T18:52:41Z,2026-03-24T15:43:45Z,49,112
NLPchina/ansj_seg,NLPchina,https://github.com/NLPchina/ansj_seg,"ansj分词.ict的真正java实现.分词效果速度都超过开源版的ict. 中文分词,人名识别,词性标注,用户自定义词典",Java,6545,2289,2012-09-05T05:56:24Z,2026-03-22T08:59:51Z,47,664
ximsfei/Android-skin-support,ximsfei,https://github.com/ximsfei/Android-skin-support,"Android-skin-support is an easy dynamic skin framework to use  for Android, Only one line of code to integrate it. Android 换肤框架, 极低的学习成本, 极好的用户体验. ""一行""代码就可以实现换肤, 你值得拥有!!!",Java,6521,1100,2017-01-12T15:03:54Z,2026-03-25T10:47:27Z,102,361
processing/processing,processing,https://github.com/processing/processing,⚠️ Processing moved to processing/processing4 ⚠️,Java,6497,1477,2013-01-24T21:17:22Z,2026-03-25T00:57:52Z,472,4669
nayuki/QR-Code-generator,nayuki,https://github.com/nayuki/QR-Code-generator,"High-quality QR Code generator library in Java, TypeScript/JavaScript, Python, Rust, C++, C.",Java,6486,1252,2016-04-15T02:19:41Z,2026-03-25T16:09:21Z,5,144
hibernate/hibernate-orm,hibernate,https://github.com/hibernate/hibernate-orm,Idiomatic persistence for Java and relational databases,Java,6462,3740,2010-10-04T16:15:52Z,2026-03-25T20:22:53Z,0,0
ArthurHub/Android-Image-Cropper,ArthurHub,https://github.com/ArthurHub/Android-Image-Cropper,"Image Cropping Library for Android, optimized for Camera / Gallery.",Java,6430,1370,2015-01-15T10:49:37Z,2026-03-25T16:06:41Z,345,443
wxiaoqi/Spring-Cloud-Platform,wxiaoqi,https://github.com/wxiaoqi/Spring-Cloud-Platform,🔥🔥🔥国内首个Spring Cloud微服务化RBAC的管理平台，核心采用Spring Boot 2.4、Spring Cloud 2020.0.0 & Alibaba，前端采用d2-admin中台框架。 🔝 🔝 记得上边点个star 关注更新,Java,6430,2366,2017-05-25T10:35:26Z,2026-03-25T16:49:38Z,1,34
vinc3m1/RoundedImageView,vinc3m1,https://github.com/vinc3m1/RoundedImageView,"A fast ImageView that supports rounded corners, ovals, and circles.",Java,6420,1242,2013-02-22T01:17:37Z,2026-03-19T14:36:33Z,0,223
freeok/so-novel,freeok,https://github.com/freeok/so-novel,小说下载｜网文下载 | 网络小说,Java,6418,511,2022-05-23T15:49:36Z,2026-03-26T02:30:51Z,17,186
jetlinks/jetlinks-community,jetlinks,https://github.com/jetlinks/jetlinks-community,"JetLinks  基于Java,Spring Boot ,WebFlux,Netty,Vert.x,Reactor等开发, 是一个全响应式的企业级物联网平台。支持统一物模型管理,多种设备,多种厂家,统一管理。统一设备连接管理,多协议适配(TCP,MQTT,UDP,CoAP,HTTP等),屏蔽网络编程复杂性,灵活接入不同厂家不同协议等设备。实时数据处理,设备告警,消息通知,数据转发。地理位置,数据可视化等。能帮助你快速建立物联网相关业务系统。",Java,6415,1870,2020-01-02T07:27:34Z,2026-03-26T02:58:29Z,47,402
gephi/gephi,gephi,https://github.com/gephi/gephi,Gephi - The Open Graph Viz Platform,Java,6410,1599,2011-10-22T03:14:46Z,2026-03-25T13:10:18Z,498,2124
Javen205/IJPay,Javen205,https://github.com/Javen205/IJPay,IJPay 让支付触手可及，封装了微信支付、QQ支付、支付宝支付、京东支付、银联支付、PayPal 支付等常用的支付方式以及各种常用的接口。不依赖任何第三方 mvc 框架，仅仅作为工具使用简单快速完成支付模块的开发，可轻松嵌入到任何系统里。右上角点下小星星✨ ,Java,6410,1479,2017-05-02T03:15:32Z,2026-03-25T17:13:30Z,13,57
AsyncHttpClient/async-http-client,AsyncHttpClient,https://github.com/AsyncHttpClient/async-http-client,Asynchronous Http and WebSocket Client library for Java ,Java,6408,1593,2011-03-07T13:41:46Z,2026-03-25T22:08:19Z,92,1252
micronaut-projects/micronaut-core,micronaut-projects,https://github.com/micronaut-projects/micronaut-core,Micronaut Application Framework,Java,6395,1171,2018-03-07T12:05:08Z,2026-03-25T22:09:48Z,630,3571
aa112901/remusic,aa112901,https://github.com/aa112901/remusic,仿网易云音乐 安卓版，netease  android，音乐播放器 在线 下载,Java,6383,1922,2016-03-24T06:20:39Z,2026-03-26T02:36:35Z,88,29
apache/flink-cdc,apache,https://github.com/apache/flink-cdc,Flink CDC is a streaming data integration tool,Java,6381,2134,2020-07-27T19:23:33Z,2026-03-26T01:57:45Z,1,1731
graphhopper/graphhopper,graphhopper,https://github.com/graphhopper/graphhopper,Open source routing engine for OpenStreetMap. Use it as Java library or standalone web server.,Java,6370,1895,2012-02-18T19:57:38Z,2026-03-26T02:03:43Z,204,1476
joelittlejohn/jsonschema2pojo,joelittlejohn,https://github.com/joelittlejohn/jsonschema2pojo,"Generate Java types from JSON or JSON Schema and annotate those types for data-binding with Jackson, Gson, etc",Java,6369,1672,2013-06-22T22:28:53Z,2026-03-24T07:44:41Z,179,1031
haifengl/smile,haifengl,https://github.com/haifengl/smile,Statistical Machine Intelligence & Learning Engine,Java,6357,1146,2014-11-20T16:28:12Z,2026-03-25T00:11:37Z,6,657
DerekYRC/mini-spring,DerekYRC,https://github.com/DerekYRC/mini-spring,mini-spring is a simplified version of the Spring framework that helps you quickly familiarize yourself with Spring source code and master Spring's core principles. It extracts Spring's core logic with extremely simplified code while preserving Spring's core functionality.,Java,6356,1450,2020-11-17T11:59:18Z,2026-03-25T12:02:26Z,30,14
wasabeef/richeditor-android,wasabeef,https://github.com/wasabeef/richeditor-android,RichEditor for Android is a beautiful Rich Text WYSIWYG Editor for Android.,Java,6348,1207,2015-03-30T16:19:20Z,2026-03-25T12:20:13Z,218,46
sshahine/JFoenix,sshahine,https://github.com/sshahine/JFoenix,JavaFX Material Design Library,Java,6347,1050,2015-09-08T14:04:24Z,2026-03-21T13:19:47Z,127,978
amitshekhariitbhu/from-java-to-kotlin,amitshekhariitbhu,https://github.com/amitshekhariitbhu/from-java-to-kotlin,From Java To Kotlin - Your Cheat Sheet For Java To Kotlin,Java,6337,785,2017-05-21T11:56:27Z,2026-03-26T01:10:55Z,5,6
apache/iotdb,apache,https://github.com/apache/iotdb,Apache IoTDB,Java,6302,1128,2018-11-24T21:29:17Z,2026-03-26T01:41:15Z,419,574
lightbend/config,lightbend,https://github.com/lightbend/config,configuration library for JVM languages using HOCON files,Java,6296,979,2011-12-06T08:02:29Z,2026-03-25T14:08:05Z,236,300
koush/ion,koush,https://github.com/koush/ion,Android Asynchronous Networking and Image Loading,Java,6264,1027,2013-05-22T07:41:23Z,2026-03-25T14:20:37Z,329,556
graphql-java/graphql-java,graphql-java,https://github.com/graphql-java/graphql-java,GraphQL Java implementation,Java,6235,1148,2015-07-06T06:52:20Z,2026-03-23T01:39:20Z,37,1333
apache/incubator-kie-drools,apache,https://github.com/apache/incubator-kie-drools,"Drools is a rule engine, DMN engine and complex event processing (CEP) engine for Java",Java,6230,2580,2011-02-18T08:37:05Z,2026-03-25T00:47:05Z,73,223
ityouknow/spring-cloud-examples,ityouknow,https://github.com/ityouknow/spring-cloud-examples,Spring Cloud 学习案例，服务发现、服务治理、链路追踪、服务监控等,Java,6217,3066,2017-04-28T08:48:53Z,2026-03-20T07:08:09Z,2,35
auth0/java-jwt,auth0,https://github.com/auth0/java-jwt,Java implementation of JSON Web Token (JWT),Java,6206,948,2014-03-07T15:06:11Z,2026-03-26T02:09:20Z,8,305
google/grafika,google,https://github.com/google/grafika,Grafika test app,Java,6160,1478,2013-12-19T18:36:53Z,2026-03-25T14:19:42Z,54,55
apache/camel,apache,https://github.com/apache/camel,Apache Camel is an open source integration framework that empowers you to quickly and easily integrate various systems consuming or producing data.,Java,6156,5098,2009-05-21T00:25:36Z,2026-03-25T14:23:42Z,0,0
Vedenin/useful-java-links,Vedenin,https://github.com/Vedenin/useful-java-links,"A list of useful Java frameworks, libraries, software and hello worlds examples",Java,6152,1203,2016-02-13T13:14:52Z,2026-03-25T10:37:46Z,1,18
alipay/SoloPi,alipay,https://github.com/alipay/SoloPi,SoloPi 自动化测试工具,Java,6149,1247,2019-03-14T15:32:49Z,2026-03-25T02:46:54Z,135,75
loks666/get_jobs,loks666,https://github.com/loks666/get_jobs,💼【AI找工作助手】全平台自动投简历脚本：(boss、前程无忧、猎聘、智联招聘),Java,6138,780,2024-03-07T21:34:58Z,2026-03-26T02:18:54Z,6,52
LandGrey/SpringBootVulExploit,LandGrey,https://github.com/LandGrey/SpringBootVulExploit,SpringBoot 相关漏洞学习资料，利用方法和技巧合集，黑盒安全评估 check list,Java,6126,1320,2020-05-20T09:18:44Z,2026-03-24T12:14:10Z,5,4
obsidiandynamics/kafdrop,obsidiandynamics,https://github.com/obsidiandynamics/kafdrop,Kafka Web UI,Java,6126,893,2019-05-27T08:46:56Z,2026-03-24T13:46:09Z,0,355
vavr-io/vavr,vavr-io,https://github.com/vavr-io/vavr,"vʌvr (formerly called Javaslang) is a non-commercial, non-profit object-functional library that runs with Java 8+. It aims to reduce the lines of code and increase code quality.",Java,6126,660,2014-01-30T14:07:25Z,2026-03-25T13:15:36Z,77,1152
apache/hudi,apache,https://github.com/apache/hudi,"Upserts, Deletes And Incremental Processing on Big Data.",Java,6122,2470,2016-12-14T15:53:41Z,2026-03-25T19:15:01Z,3525,3383
ikew0ng/SwipeBackLayout,ikew0ng,https://github.com/ikew0ng/SwipeBackLayout,An Android library that help you to build app with swipe back gesture.,Java,6104,1395,2013-08-25T03:36:12Z,2026-03-26T03:22:53Z,111,63
google/google-java-format,google,https://github.com/google/google-java-format,Reformats Java source code to comply with Google Java Style.,Java,6099,917,2015-05-11T20:38:28Z,2026-03-26T02:37:42Z,135,528
rengwuxian/MaterialEditText,rengwuxian,https://github.com/rengwuxian/MaterialEditText,EditText in Material Design,Java,6099,1038,2014-10-30T10:07:23Z,2026-03-23T17:56:01Z,181,158
daimajia/NumberProgressBar,daimajia,https://github.com/daimajia/NumberProgressBar,"A beautiful, slim Android ProgressBar.",Java,6095,1393,2014-05-01T08:54:25Z,2026-03-26T03:23:16Z,22,33
javaparser/javaparser,javaparser,https://github.com/javaparser/javaparser,Java 1-25 Parser and Abstract Syntax Tree for Java with advanced analysis functionalities.,Java,6064,1225,2011-10-30T14:03:44Z,2026-03-25T17:31:01Z,419,1979
apache/pinot,apache,https://github.com/apache/pinot,Apache Pinot - A realtime distributed OLAP datastore,Java,6049,1459,2014-05-19T23:27:48Z,2026-03-26T00:45:07Z,1416,1841
google/j2objc,google,https://github.com/google/j2objc,A Java to iOS Objective-C translation tool and runtime.,Java,6045,999,2014-01-30T20:19:56Z,2026-03-25T20:07:29Z,66,1083
ZhongFuCheng3y/austin,ZhongFuCheng3y,https://github.com/ZhongFuCheng3y/austin,消息推送平台🔥 推送下发【邮件】【短信】【微信服务号】【微信小程序】【企业微信】【钉钉】等消息类型。,Java,6045,1457,2021-11-06T09:36:01Z,2026-03-24T04:49:08Z,3,40
singwhatiwanna/dynamic-load-apk,singwhatiwanna,https://github.com/singwhatiwanna/dynamic-load-apk,DL : dynamic load framework in android,Java,6026,1981,2014-03-30T11:51:00Z,2026-03-25T16:07:05Z,86,29
apache/nifi,apache,https://github.com/apache/nifi,Apache NiFi,Java,6025,2938,2014-12-12T08:00:05Z,2026-03-25T19:57:26Z,0,0
apache/hive,apache,https://github.com/apache/hive,Apache Hive,Java,6018,4791,2009-05-21T02:31:01Z,2026-03-26T02:59:08Z,0,0
pedrovgs/EffectiveAndroidUI,pedrovgs,https://github.com/pedrovgs/EffectiveAndroidUI,"Sample project created to show some of the best Android practices to work in the Android UI Layer. The UI layer of this project has been implemented using MVP or MVVM (without binding engine) to show how this patterns works. This project is used during the talk ""EffectiveAndroidUI"".",Java,6014,1189,2014-07-04T08:42:20Z,2026-03-20T04:57:56Z,4,14
robolectric/robolectric,robolectric,https://github.com/robolectric/robolectric,Android Unit Testing Framework,Java,6000,1380,2010-08-28T00:28:25Z,2026-03-25T00:58:23Z,400,2496
jeequan/jeepay,jeequan,https://github.com/jeequan/jeepay,Jeepay是一套适合互联网企业使用的开源支付系统，支持多渠道服务商和普通商户模式。已对接微信支付，支付宝，云闪付官方接口，支持聚合码支付。,Java,5999,1937,2017-08-12T02:40:32Z,2026-03-25T13:58:58Z,32,18
opengoofy/hippo4j,opengoofy,https://github.com/opengoofy/hippo4j,"📌 异步线程池框架，支持线程池动态变更&监控&报警，无需修改代码轻松引入。Asynchronous thread pool framework, support Thread Pool Dynamic Change & monitoring & Alarm, no need to modify the code easily introduced.",Java,5993,1240,2021-06-16T02:59:48Z,2026-03-25T08:23:28Z,100,595
WeiYe-Jing/datax-web,WeiYe-Jing,https://github.com/WeiYe-Jing/datax-web,DataX集成可视化页面，选择数据源即可一键生成数据同步任务，支持RDBMS、Hive、HBase、ClickHouse、MongoDB等数据源，批量创建RDBMS数据同步任务，集成开源调度系统，支持分布式、增量同步数据、实时查看运行日志、监控执行器资源、KILL运行进程、数据源信息加密等。,Java,5990,2250,2019-11-19T01:09:05Z,2026-03-25T18:16:40Z,300,246
btraceio/btrace,btraceio,https://github.com/btraceio/btrace,"BTrace - a safe, dynamic tracing tool for the Java platform",Java,5987,960,2014-08-28T18:58:24Z,2026-03-24T07:49:45Z,1,436
google/physical-web,google,https://github.com/google/physical-web,The Physical Web: walk up and use anything,Java,5981,651,2014-09-30T18:32:14Z,2026-03-13T18:49:35Z,90,303
rey5137/material,rey5137,https://github.com/rey5137/material,A library to bring fully animated Material Design components to pre-Lolipop Android. ,Java,5967,1300,2014-12-09T12:07:32Z,2026-03-22T22:38:49Z,205,223
00-Evan/shattered-pixel-dungeon,00-Evan,https://github.com/00-Evan/shattered-pixel-dungeon,"Shattered Pixel Dungeon is an open-source traditional roguelike dungeon crawler with randomized levels and enemies, and hundreds of items to collect and use. It's based on the source code of Pixel Dungeon, by Watabou.",Java,5966,1415,2014-07-31T21:56:31Z,2026-03-26T00:37:55Z,1,2204
youtube/api-samples,youtube,https://github.com/youtube/api-samples,"Code samples for YouTube APIs, including the YouTube Data API, YouTube Analytics API, and YouTube Live Streaming API. The repo contains language-specific directories that contain the samples.",Java,5960,3055,2013-12-09T18:41:41Z,2026-03-25T21:08:46Z,319,44
wyouflf/xUtils3,wyouflf,https://github.com/wyouflf/xUtils3,"Android orm, bitmap, http, view inject... ",Java,5959,1964,2015-10-28T10:56:04Z,2026-03-16T08:31:24Z,37,676
liyifeng1994/ssm,liyifeng1994,https://github.com/liyifeng1994/ssm,手把手教你整合最优雅SSM框架：SpringMVC + Spring + MyBatis,Java,5939,2715,2016-06-18T17:58:56Z,2026-03-18T05:28:57Z,26,20
springfox/springfox,springfox,https://github.com/springfox/springfox,Automated JSON API documentation for API's built with Spring,Java,5938,1519,2012-05-06T06:38:57Z,2026-03-21T19:48:23Z,218,3324
JSQLParser/JSqlParser,JSQLParser,https://github.com/JSQLParser/JSqlParser,JSqlParser parses an SQL statement and translate it into a hierarchy of Java classes. The generated hierarchy can be navigated using the Visitor Pattern,Java,5936,1418,2011-06-23T22:51:52Z,2026-03-25T13:44:24Z,74,1580
journeyapps/zxing-android-embedded,journeyapps,https://github.com/journeyapps/zxing-android-embedded,"Barcode scanner library for Android, based on the ZXing decoder",Java,5935,1292,2012-11-28T16:36:39Z,2026-03-25T15:13:12Z,110,499
prolificinteractive/material-calendarview,prolificinteractive,https://github.com/prolificinteractive/material-calendarview,A Material design back port of Android's CalendarView,Java,5930,1301,2015-02-09T22:31:56Z,2026-03-25T12:23:15Z,226,693
antoniolg/androidmvp,antoniolg,https://github.com/antoniolg/androidmvp,MVP Android Example,Java,5910,1556,2014-04-02T05:42:20Z,2026-03-18T11:51:27Z,1,17
weibocom/motan,weibocom,https://github.com/weibocom/motan,A cross-language remote procedure call(RPC) framework for rapid development of high performance distributed services.,Java,5908,1755,2016-04-20T10:56:17Z,2026-03-22T03:54:30Z,363,432
Archmage83/tvapk,Archmage83,https://github.com/Archmage83/tvapk,收集各大AndroidTV的apk应用，可免费看vip和国外电影电视。如大家有也可以贡献一下。,Java,5904,566,2020-07-29T08:04:37Z,2026-03-25T12:22:34Z,15,29
apache/fesod,apache,https://github.com/apache/fesod,Fast. Easy. Done. Processing spreadsheets without worrying about large files causing OOM.,Java,5895,489,2024-10-05T11:42:50Z,2026-03-25T11:08:05Z,106,303
amitshekhariitbhu/Fast-Android-Networking,amitshekhariitbhu,https://github.com/amitshekhariitbhu/Fast-Android-Networking,🚀 A Complete Fast Android Networking Library that also supports HTTP/2 🚀,Java,5890,973,2016-03-21T18:35:44Z,2026-03-24T20:49:33Z,221,346
lets-blade/blade,lets-blade,https://github.com/lets-blade/blade,:rocket: Lightning fast and elegant mvc framework for Java8,Java,5884,1162,2015-06-10T03:35:49Z,2026-03-22T23:47:18Z,12,249
JakeWharton/DiskLruCache,JakeWharton,https://github.com/JakeWharton/DiskLruCache,Java implementation of a Disk-based LRU cache which specifically targets Android compatibility.,Java,5865,1170,2012-01-05T00:36:34Z,2026-03-26T03:21:38Z,19,37
ikarus23/MifareClassicTool,ikarus23,https://github.com/ikarus23/MifareClassicTool,"An Android NFC app for reading, writing, analyzing, etc. MIFARE Classic RFID tags.",Java,5858,990,2013-02-12T15:39:03Z,2026-03-25T13:42:23Z,31,331
ffay/lanproxy,ffay,https://github.com/ffay/lanproxy,lanproxy是一个将局域网个人电脑、服务器代理到公网的内网穿透工具，支持tcp流量转发，可支持任何tcp上层协议（访问内网网站、本地支付接口调试、ssh访问、远程桌面、http代理、https代理、socks5代理...）。技术交流QQ群 736294209,Java,5857,1555,2016-11-20T08:12:10Z,2026-03-20T02:02:43Z,131,37
PBH-BTN/PeerBanHelper,PBH-BTN,https://github.com/PBH-BTN/PeerBanHelper,"Automatically block unwanted, leeches and abnormal BT peers with support for customized and cloud rules.| BT 反吸血工具 - 自动封禁不受欢迎、吸血和异常的 BT 客户端，并支持自定义规则。支持 qB/qBEE/Deluge/BiglyBT/BitComet",Java,5854,140,2024-02-07T14:35:16Z,2026-03-26T01:53:10Z,11,566
meefik/linuxdeploy,meefik,https://github.com/meefik/linuxdeploy,Install and run GNU/Linux on Android,Java,5794,724,2012-08-21T04:49:14Z,2026-03-24T12:44:47Z,734,565
Nightonke/BoomMenu,Nightonke,https://github.com/Nightonke/BoomMenu,A menu which can ... BOOM! - Android,Java,5792,1139,2016-03-19T12:04:12Z,2026-03-26T02:37:49Z,115,132
yarolegovich/DiscreteScrollView,yarolegovich,https://github.com/yarolegovich/DiscreteScrollView,A scrollable list of items that centers the current element and provides easy-to-use APIs for cool item animations.,Java,5786,784,2017-03-03T23:38:54Z,2026-03-25T16:07:24Z,42,151
changmingxie/tcc-transaction,changmingxie,https://github.com/changmingxie/tcc-transaction,tcc-transaction是TCC型事务java实现,Java,5776,2769,2015-12-05T04:27:53Z,2026-03-21T19:47:24Z,8,290
Nepxion/Discovery,Nepxion,https://github.com/Nepxion/Discovery,"☀️ Nepxion Discovery is a solution for Spring Cloud with blue green, gray, route, limitation, circuit breaker, degrade, isolation, tracing, dye, failover, active 蓝绿灰度发布、路由、限流、熔断、降级、隔离、追踪、流量染色、故障转移、多活",Java,5774,1421,2018-06-21T16:16:49Z,2026-03-24T02:43:08Z,14,104
dmytrodanylyk/circular-progress-button,dmytrodanylyk,https://github.com/dmytrodanylyk/circular-progress-button,Android Circular Progress Button,Java,5757,1170,2014-06-07T12:58:48Z,2026-03-23T17:56:00Z,0,0
strimzi/strimzi-kafka-operator,strimzi,https://github.com/strimzi/strimzi-kafka-operator,Apache Kafka® running on Kubernetes,Java,5752,1467,2016-05-06T08:52:33Z,2026-03-25T15:44:52Z,128,2854
houbb/sensitive-word,houbb,https://github.com/houbb/sensitive-word, 👮‍♂️The sensitive word tool for java.(敏感词/违禁词/违法词/脏词。基于 DFA 算法实现的高性能 java 敏感词过滤工具框架。内置支持单词标签分类分级。请勿发布涉及政治、广告、营销、翻墙、违反国家法律法规等内容。高性能敏感词检测过滤组件，附带繁体简体互换，支持全角半角互换，汉字转拼音，模糊搜索等功能。),Java,5750,781,2020-01-07T03:10:44Z,2026-03-25T20:26:37Z,9,106
JanusGraph/janusgraph,JanusGraph,https://github.com/JanusGraph/janusgraph,"JanusGraph: an open-source, distributed graph database",Java,5747,1207,2016-12-26T13:26:29Z,2026-03-25T09:25:01Z,514,1125
k0shk0sh/FastHub,k0shk0sh,https://github.com/k0shk0sh/FastHub,FastHub the ultimate GitHub client for Android.,Java,5735,931,2017-02-18T17:53:16Z,2026-03-25T12:37:33Z,334,2198
dromara/lamp-cloud,dromara,https://github.com/dromara/lamp-cloud,[灯灯]微服务中后台快速开发平台，支持jdk21、jdk17、jdk8，专注于多租户、开放平台解决方案，亦可作为普通项目（非SaaS架构）的基础开发框架使用，目前已实现插拔式数据库隔离、SCHEMA隔离、字段隔离 等租户隔离方案。,Java,5732,1753,2018-01-17T02:51:04Z,2026-03-26T02:54:49Z,5,174
jagrosh/MusicBot,jagrosh,https://github.com/jagrosh/MusicBot,🎶 A Discord music bot that's easy to set up and run yourself!,Java,5730,2780,2016-08-14T18:46:29Z,2026-03-25T16:06:46Z,182,868
redis/lettuce,redis,https://github.com/redis/lettuce,"Advanced Java Redis client for thread-safe sync, async, and reactive usage. Supports Cluster, Sentinel, Pipelining, and codecs.",Java,5729,1072,2014-05-10T13:08:46Z,2026-03-26T02:09:28Z,194,2364
ZHENFENG13/spring-boot-projects,ZHENFENG13,https://github.com/ZHENFENG13/spring-boot-projects,:fire: 该仓库中主要是 Spring Boot 的入门学习教程以及一些常用的 Spring Boot 实战项目教程，包括 Spring Boot 使用的各种示例代码，同时也包括一些实战项目的项目源码和效果展示，实战项目包括基本的 web 开发以及目前大家普遍使用的线上博客项目/企业大型商城系统/前后端分离实践项目等，摆脱各种 hello world 入门案例的束缚，真正的掌握 Spring Boot 开发。,Java,5719,1628,2017-04-01T01:50:14Z,2026-03-26T02:02:54Z,2,9
yanzhenjie/SwipeRecyclerView,yanzhenjie,https://github.com/yanzhenjie/SwipeRecyclerView,:melon: RecyclerView侧滑菜单，Item拖拽，滑动删除Item，自动加载更多，HeaderView，FooterView，Item分组黏贴。,Java,5718,1095,2016-08-03T15:43:34Z,2026-03-26T03:21:00Z,113,206
ddd-by-examples/library,ddd-by-examples,https://github.com/ddd-by-examples/library,A comprehensive Domain-Driven Design example with problem space strategic analysis and various tactical patterns.,Java,5711,815,2019-01-11T09:14:03Z,2026-03-24T09:20:36Z,18,23
jpush/aurora-imui,jpush,https://github.com/jpush/aurora-imui,General IM UI components. Android/iOS/RectNative ready.  通用 IM 聊天 UI 组件，已经同时支持 Android/iOS/RN。,Java,5709,995,2016-12-13T05:24:01Z,2026-03-20T16:14:06Z,117,442
Devlight/InfiniteCycleViewPager,Devlight,https://github.com/Devlight/InfiniteCycleViewPager,Infinite cycle ViewPager with two-way orientation and interactive effect.,Java,5703,823,2016-08-22T08:04:39Z,2026-03-26T03:23:15Z,56,24
