nameWithOwner,owner,url,description,primaryLanguage,stars,forks,createdAt,updatedAt,openIssues,closedIssues
phishman3579/java-algorithms-implementation,phishman3579,https://github.com/phishman3579/java-algorithms-implementation,Algorithms and Data Structures implemented in Java,Java,4532,1852,2013-11-20T03:30:19Z,2026-03-25T13:48:14Z,13,29
alibaba/dexposed,alibaba,https://github.com/alibaba/dexposed,dexposed enable 'god' mode for single android application.,Java,4518,1062,2015-06-30T02:59:16Z,2026-03-17T07:10:18Z,19,51
jacoco/jacoco,jacoco,https://github.com/jacoco/jacoco,:microscope: Java Code Coverage Library,Java,4517,1200,2012-07-08T21:45:13Z,2026-03-24T12:48:16Z,132,880
201206030/novel-plus,201206030,https://github.com/201206030/novel-plus,novel-plus 是一个多端（PC、WAP）阅读 、功能完善的小说 CMS 系统。包括小说推荐、小说检索、小说排行、小说阅读、小说书架、小说评论、小说爬虫、会员中心、作家专区、充值订阅、新闻发布等功能。,Java,4516,1475,2020-05-02T07:15:43Z,2026-03-24T14:16:02Z,0,0
IoT-Technology/IoT-Technical-Guide,IoT-Technology,https://github.com/IoT-Technology/IoT-Technical-Guide,":honeybee: IoT Technical Guide --- 从零搭建高性能物联网平台及物联网解决方案和Thingsboard源码分析 :sparkles: :sparkles: :sparkles: (IoT Platform, SaaS, MQTT, CoAP, HTTP, Modbus, OPC, WebSocket, 物模型，Protobuf, PostgreSQL, MongoDB, Spring Security, OAuth2, RuleEngine, Kafka, Docker)",Java,4515,1115,2019-04-02T01:52:44Z,2026-03-26T00:41:24Z,1,7
azkaban/azkaban,azkaban,https://github.com/azkaban/azkaban,Azkaban workflow manager.,Java,4515,1572,2012-10-18T01:34:53Z,2026-03-20T17:46:58Z,693,403
castorflex/SmoothProgressBar,castorflex,https://github.com/castorflex/SmoothProgressBar,A small Android library allowing you to have a smooth and customizable horizontal or circular indeterminate ProgressBar,Java,4514,1002,2013-11-27T20:32:16Z,2026-03-21T18:01:06Z,12,75
Flipboard/bottomsheet,Flipboard,https://github.com/Flipboard/bottomsheet,Android component which presents a dismissible view from the bottom of the screen,Java,4506,594,2015-04-23T17:37:32Z,2026-03-13T18:47:28Z,51,93
Freeyourgadget/Gadgetbridge,Freeyourgadget,https://github.com/Freeyourgadget/Gadgetbridge,"We are on codeberg.org now! https://codeberg.org/Freeyourgadget/Gadgetbridge -  Gadgetbridge - A free and cloudless replacement for your gadget vendors' closed source Android applications. Supports Pebble, Mi Band, Liveview, HPlus and more.",Java,4486,661,2015-01-05T23:19:03Z,2026-03-25T19:16:20Z,0,0
HotBitmapGG/bilibili-android-client,HotBitmapGG,https://github.com/HotBitmapGG/bilibili-android-client,An unofficial bilibili client for android  http://www.jianshu.com/p/f69a55b94c05   -- 该项目已停止维护！,Java,4486,1466,2016-06-01T04:36:01Z,2026-03-22T12:46:37Z,9,59
JakeWharton/NineOldAndroids,JakeWharton,https://github.com/JakeWharton/NineOldAndroids,[DEPRECATED] Android library for using the Honeycomb animation API on all versions of the platform back to 1.0!,Java,4472,1523,2011-12-08T19:46:37Z,2026-02-24T09:30:11Z,30,36
water8394/flink-recommandSystem-demo,water8394,https://github.com/water8394/flink-recommandSystem-demo,:helicopter::rocket:基于Flink实现的商品实时推荐系统。flink统计商品热度，放入redis缓存，分析日志信息，将画像标签和实时记录放入Hbase。在用户发起推荐请求后，根据用户画像重排序热度榜，并结合协同过滤和标签两个推荐模块为新生成的榜单的每一个产品添加关联产品，最后返回新的用户列表。,Java,4472,1480,2019-05-15T07:55:35Z,2026-03-24T08:38:45Z,12,27
Meituan-Dianping/Robust,Meituan-Dianping,https://github.com/Meituan-Dianping/Robust,Robust is an Android HotFix solution with high compatibility and high stability. Robust can fix bugs immediately without a reboot.,Java,4468,808,2017-03-14T10:14:50Z,2026-03-24T07:47:18Z,156,233
s4kibs4mi/java-developer-roadmap,s4kibs4mi,https://github.com/s4kibs4mi/java-developer-roadmap,Roadmap to becoming a Java developer in 2026,Java,4455,562,2019-04-23T06:42:13Z,2026-03-24T21:51:47Z,0,10
flutter-webrtc/flutter-webrtc,flutter-webrtc,https://github.com/flutter-webrtc/flutter-webrtc,WebRTC plugin for Flutter Mobile/Desktop/Web,Java,4454,1351,2018-03-07T02:26:03Z,2026-03-25T18:00:39Z,691,716
apache/shiro,apache,https://github.com/apache/shiro,"Apache Shiro is a powerful and easy-to-use Java security framework that performs authentication, authorization, cryptography, and session management",Java,4439,2302,2009-08-29T08:00:17Z,2026-03-25T04:20:36Z,6,146
janishar/android-mvp-architecture,janishar,https://github.com/janishar/android-mvp-architecture,"This repository contains a detailed sample app that implements MVP architecture using Dagger2,  GreenDao, RxJava2, FastAndroidNetworking and PlaceholderView",Java,4434,1239,2017-01-27T08:39:06Z,2026-03-26T02:39:38Z,33,41
dreamhead/moco,dreamhead,https://github.com/dreamhead/moco,Easy Setup Stub Server,Java,4432,1084,2012-10-18T09:09:51Z,2026-03-23T02:36:41Z,139,127
square/android-times-square,square,https://github.com/square/android-times-square,Standalone Android widget for picking a single date from a calendar view.,Java,4427,1182,2013-01-30T20:28:27Z,2026-03-24T15:09:28Z,23,328
Tencent/GT,Tencent,https://github.com/Tencent/GT,GT (Great Tit) is a portable debugging tool for bug hunting and performance tuning on smartphones anytime and anywhere just as listening music with Walkman. GT can act as the Integrated Debug Environment by directly running on smartphones.,Java,4415,1022,2016-01-13T10:29:55Z,2026-03-19T08:41:33Z,69,22
ThirtyDegreesRay/OpenHub,ThirtyDegreesRay,https://github.com/ThirtyDegreesRay/OpenHub,"An open source GitHub Android client app, faster and concise.",Java,4396,425,2017-07-11T13:29:51Z,2026-03-24T03:03:49Z,237,127
Snailclimb/guide-rpc-framework,Snailclimb,https://github.com/Snailclimb/guide-rpc-framework,A custom RPC framework implemented by Netty+Kyro+Zookeeper.（一款基于 Netty+Kyro+Zookeeper 实现的自定义 RPC 框架-附详细实现过程和相关教程。）,Java,4395,2177,2020-05-10T13:24:42Z,2026-03-23T16:05:24Z,23,18
robinhood/ticker,robinhood,https://github.com/robinhood/ticker,An Android text view with scrolling text change animation,Java,4383,462,2016-07-15T21:37:52Z,2026-03-25T16:07:05Z,16,65
crate/crate,crate,https://github.com/crate/crate,"CrateDB is a distributed and scalable SQL database for storing and analyzing massive amounts of data in near real-time, even with complex queries. It is PostgreSQL-compatible, and based on Lucene.",Java,4375,589,2013-04-10T09:17:16Z,2026-03-25T13:37:51Z,298,2081
Querz/mcaselector,Querz,https://github.com/Querz/mcaselector,A tool to select chunks from Minecraft worlds for deletion or export.,Java,4364,226,2018-04-22T22:23:26Z,2026-03-25T15:35:17Z,212,241
pytorch/serve,pytorch,https://github.com/pytorch/serve,"Serve, optimize and scale PyTorch models in production",Java,4360,887,2019-10-03T03:17:43Z,2026-03-19T15:48:13Z,386,1275
Ashok-Varma/BottomNavigation,Ashok-Varma,https://github.com/Ashok-Varma/BottomNavigation,This Library helps users to use Bottom Navigation Bar (A new pattern from google) with ease and allows ton of customizations,Java,4359,680,2016-03-19T19:19:30Z,2026-03-22T10:16:24Z,26,175
awangdev/leet-code,awangdev,https://github.com/awangdev/leet-code,Java Solutions to problems on LintCode/LeetCode,Java,4358,27,2015-04-25T19:14:09Z,2026-03-10T08:32:51Z,0,9
eirslett/frontend-maven-plugin,eirslett,https://github.com/eirslett/frontend-maven-plugin,"""Maven-node-grunt-gulp-npm-node-plugin to end all maven-node-grunt-gulp-npm-plugins."" A Maven plugin that downloads/installs Node and NPM locally, runs NPM install, Grunt, Gulp and/or Karma.",Java,4350,880,2013-08-30T14:44:38Z,2026-03-18T17:47:38Z,266,561
mywalkb/LSPosed_mod,mywalkb,https://github.com/mywalkb/LSPosed_mod,My changes to LSPosed,Java,4341,264,2022-03-28T08:05:38Z,2026-03-26T01:23:21Z,49,52
AsamK/signal-cli,AsamK,https://github.com/AsamK/signal-cli,"signal-cli provides an unofficial commandline, JSON-RPC and dbus interface for the Signal messenger.",Java,4339,393,2015-05-11T10:49:42Z,2026-03-26T01:39:21Z,94,1265
iterate-ch/cyberduck,iterate-ch,https://github.com/iterate-ch/cyberduck,"Cyberduck is a libre FTP, SFTP, WebDAV, Amazon S3, Backblaze B2, Microsoft Azure & OneDrive and OpenStack Swift file transfer client for Mac and Windows.",Java,4337,344,2017-01-20T14:16:34Z,2026-03-25T20:10:43Z,475,11918
BoCloud/folib,BoCloud,https://github.com/BoCloud/folib,"全语言制品仓库，涵盖npm、Maven、PyPi、Docker、Gradle、SBT、Cocoapods、Swift、RPM、Debian、PHP、Go、Pub、Ivy、NuGet、Conda、Cargo、Conan、Yarn、GitLFS、Helm、OHPM等主流工具,涵盖Huggingface 等主流AI模型仓库的代理与同步",Java,4325,250,2025-07-09T06:22:58Z,2026-03-25T02:47:13Z,3,0
dragonwell-project/dragonwell8,dragonwell-project,https://github.com/dragonwell-project/dragonwell8,Alibaba Dragonwell8 JDK,Java,4321,502,2019-03-07T02:57:45Z,2026-03-25T11:46:10Z,162,345
jitsi/jitsi,jitsi,https://github.com/jitsi/jitsi,"Jitsi is an audio/video and chat communicator that supports protocols such as SIP, XMPP/Jabber, IRC and many other useful features.",Java,4320,976,2013-04-24T17:37:20Z,2026-03-23T17:58:30Z,209,302
jlegewie/zotfile,jlegewie,https://github.com/jlegewie/zotfile,"Zotero plugin to manage your attachments: automatically rename, move, and attach PDFs (or other files) to Zotero items, sync PDFs from your Zotero library to your (mobile) PDF reader (e.g. an iPad, Android tablet, etc.), and extract PDF annotations.",Java,4319,290,2011-12-30T14:47:42Z,2026-03-25T16:08:13Z,278,271
jeasonlzy/ImagePicker,jeasonlzy,https://github.com/jeasonlzy/ImagePicker,完全仿微信的图片选择，并且提供了多种图片加载接口，选择图片后可以旋转，可以裁剪成矩形或圆形，可以配置各种其他的参数,Java,4311,1029,2016-01-27T17:05:03Z,2026-03-24T23:12:10Z,161,120
google/open-location-code,google,https://github.com/google/open-location-code,"Open Location Code is a library to generate short codes, called ""plus codes"", that can be used as digital addresses where street addresses don't exist.",Java,4309,520,2014-09-30T18:26:35Z,2026-03-24T05:25:50Z,34,244
failsafe-lib/failsafe,failsafe-lib,https://github.com/failsafe-lib/failsafe,Fault tolerance and resilience patterns for the JVM,Java,4307,309,2015-06-30T00:56:39Z,2026-03-23T08:19:33Z,66,246
torakiki/pdfsam,torakiki,https://github.com/torakiki/pdfsam,"PDFsam, a desktop application to split, merge, mix, rotate PDF files and extract pages",Java,4306,391,2013-09-24T11:06:13Z,2026-03-25T12:19:16Z,115,511
bingoogolapple/BGARefreshLayout-Android,bingoogolapple,https://github.com/bingoogolapple/BGARefreshLayout-Android,多种下拉刷新效果、上拉加载更多、可配置自定义头部广告位,Java,4304,998,2015-05-28T16:17:00Z,2026-03-18T12:26:34Z,95,63
geoserver/geoserver,geoserver,https://github.com/geoserver/geoserver,Official GeoServer repository,Java,4302,2289,2011-11-10T19:56:06Z,2026-03-26T03:14:07Z,0,0
apache/streampark,apache,https://github.com/apache/streampark,Make stream processing easier! Easy-to-use streaming application development framework and operation platform.,Java,4300,1065,2019-05-27T05:56:03Z,2026-03-25T06:12:42Z,285,1284
JabRef/jabref,JabRef,https://github.com/JabRef/jabref,Graphical Java application for managing BibTeX and BibLaTeX (.bib) databases,Java,4294,3300,2014-03-11T14:48:42Z,2026-03-25T22:12:17Z,495,4477
brianway/java-learning,brianway,https://github.com/brianway/java-learning,旨在打造在线最佳的 Java 学习笔记，含博客讲解和源码实例，包括 Java SE 和 Java Web,Java,4290,1190,2016-02-09T05:20:58Z,2026-03-21T05:50:52Z,2,6
apache/fory,apache,https://github.com/apache/fory,A blazingly fast multi-language serialization framework powered by JIT and zero-copy.,Java,4286,408,2023-04-28T03:57:00Z,2026-03-25T06:40:49Z,129,1238
alibaba/fastjson2,alibaba,https://github.com/alibaba/fastjson2,🚄 FASTJSON2 is a Java JSON  library with excellent performance.,Java,4285,555,2022-04-17T04:27:24Z,2026-03-24T08:17:48Z,613,1605
bjmashibing/InternetArchitect,bjmashibing,https://github.com/bjmashibing/InternetArchitect,年薪百万互联网架构师课程文档及源码(公开部分),Java,4281,2854,2019-10-19T16:32:01Z,2026-03-25T02:46:15Z,4,1
mcxiaoke/android-volley,mcxiaoke,https://github.com/mcxiaoke/android-volley,DEPRECATED,Java,4272,1543,2013-05-21T05:35:26Z,2026-03-24T13:33:56Z,61,78
camunda/camunda-bpm-platform,camunda,https://github.com/camunda/camunda-bpm-platform,Camunda 7 CE is End of Life (EoL). Please check out Camunda 8 instead (https://github.com/camunda/camunda) or read about Camunda 7 Enterprise End of Life (https://camunda.com/blog/2025/02/camunda-7-enterprise-end-of-life-extension/) – Camunda 7 CE was a flexible framework for workflow and decision automation using BPMN and DMN.,Java,4268,1708,2013-01-03T10:10:31Z,2026-03-18T13:00:59Z,0,1569
ongakuer/CircleIndicator,ongakuer,https://github.com/ongakuer/CircleIndicator,A lightweight indicator like in nexus 5 launcher,Java,4266,702,2014-07-30T14:02:56Z,2026-03-19T14:36:22Z,24,119
grantland/android-autofittextview,grantland,https://github.com/grantland/android-autofittextview,A TextView that automatically resizes text to fit perfectly within its bounds.,Java,4263,689,2011-02-14T06:00:52Z,2026-03-13T18:53:48Z,50,35
aporter/coursera-android,aporter,https://github.com/aporter/coursera-android,Source Code for Android Course Example Applications,Java,4256,5210,2014-01-05T09:55:31Z,2026-03-17T07:12:25Z,47,19
M66B/FairEmail,M66B,https://github.com/M66B/FairEmail,"Fully featured, open source, privacy friendly email app for Android",Java,4255,684,2018-08-02T13:30:25Z,2026-03-25T15:03:28Z,0,0
microsoft/malmo,microsoft,https://github.com/microsoft/malmo,"Project Malmo is a platform for Artificial Intelligence experimentation and research built on top of Minecraft. We aim to inspire a new generation of research into challenging new problems presented by this unique environment. --- For installation instructions, scroll down to *Getting Started* below, or visit the project page for more information:",Java,4253,607,2016-05-17T14:58:40Z,2026-03-26T03:07:55Z,166,546
mybatis/spring-boot-starter,mybatis,https://github.com/mybatis/spring-boot-starter,MyBatis integration with Spring Boot,Java,4249,1801,2015-09-25T13:05:15Z,2026-03-25T12:12:28Z,20,416
dromara/hmily,dromara,https://github.com/dromara/hmily,Distributed transaction solutions,Java,4248,1402,2017-09-28T06:29:01Z,2026-03-17T07:14:36Z,52,135
nining377/dolby_beta,nining377,https://github.com/nining377/dolby_beta,杜比大喇叭的β版迎来了重大的革新，合并了UnblockMusic Pro的所有功能且更加强大，同时UnblockMusicPro_Xposed项目将会停止维护，让我们欢送这位老朋友！,Java,4247,270,2020-05-19T12:13:36Z,2026-03-25T15:23:17Z,203,160
zendesk/maxwell,zendesk,https://github.com/zendesk/maxwell,"Maxwell's daemon, a mysql-to-json kafka producer",Java,4239,1036,2015-02-09T22:06:13Z,2026-03-25T09:34:10Z,216,930
jboss-javassist/javassist,jboss-javassist,https://github.com/jboss-javassist/javassist,Java bytecode engineering toolkit,Java,4230,720,2013-05-24T08:31:32Z,2026-03-23T13:02:35Z,243,154
LibrePDF/OpenPDF,LibrePDF,https://github.com/LibrePDF/OpenPDF,"OpenPDF is an open-source Java library for creating, editing, rendering, and encrypting PDF documents, as well as generating PDFs from HTML. It is licensed under the LGPL and MPL.",Java,4217,695,2016-07-11T15:50:34Z,2026-03-26T01:35:38Z,139,432
JetBrains/fernflower,JetBrains,https://github.com/JetBrains/fernflower,"Decompiler from Java bytecode to Java, used in IntelliJ IDEA.",Java,4214,724,2014-10-03T05:00:15Z,2026-03-25T17:18:37Z,0,0
ChadCSong/ShineButton,ChadCSong,https://github.com/ChadCSong/ShineButton,This is a UI lib for Android. Effects like shining.,Java,4202,544,2016-07-05T06:32:26Z,2026-03-26T03:23:19Z,26,26
aws/aws-sdk-java,aws,https://github.com/aws/aws-sdk-java,"The official AWS SDK for Java 1.x (In Maintenance Mode, End-of-Life on 12/31/2025). The AWS SDK for Java 2.x is available here: https://github.com/aws/aws-sdk-java-v2/",Java,4198,2807,2010-03-22T23:34:58Z,2026-03-25T16:06:47Z,1,2361
yhaolpz/FloatWindow,yhaolpz,https://github.com/yhaolpz/FloatWindow,Andorid 任意界面悬浮窗，实现悬浮窗如此简单,Java,4198,656,2017-11-14T14:33:55Z,2026-03-24T15:43:35Z,95,43
powermock/powermock,powermock,https://github.com/powermock/powermock,PowerMock is a Java framework that allows you to unit test code normally regarded as untestable.,Java,4188,580,2014-05-28T07:53:53Z,2026-03-24T13:17:31Z,441,543
Jacksgong/JKeyboardPanelSwitch,Jacksgong,https://github.com/Jacksgong/JKeyboardPanelSwitch,For resolve the layout conflict when keybord & panel are switching (Android键盘面板冲突 布局闪动处理方案),Java,4184,683,2015-07-01T17:42:01Z,2026-03-19T04:29:33Z,61,47
syncthing/syncthing-android,syncthing,https://github.com/syncthing/syncthing-android,Wrapper of syncthing for Android.,Java,4183,514,2014-02-22T17:15:19Z,2026-03-25T18:00:48Z,152,1246
hugeterry/CoordinatorTabLayout,hugeterry,https://github.com/hugeterry/CoordinatorTabLayout,Combination of TabLayout and CoordinatorLayout./TabLayout和CoordinatorLayout相结合的折叠控件,Java,4183,582,2017-01-27T13:40:28Z,2026-03-18T12:27:02Z,15,22
oddfar/campus-imaotai,oddfar,https://github.com/oddfar/campus-imaotai,i茅台app自动预约，每日自动预约，支持docker一键部署（本项目不提供成品，使用的是已淘汰的算法）,Java,4183,1370,2023-07-07T10:37:13Z,2026-03-24T09:24:08Z,54,274
codingapi/tx-lcn,codingapi,https://github.com/codingapi/tx-lcn,"LCN distributed transaction framework, compatible with dubbo, spring cloud and Motan framework, supports various relational databases",Java,4182,1447,2017-11-11T03:34:34Z,2026-03-23T07:59:53Z,195,279
jMonkeyEngine/jmonkeyengine,jMonkeyEngine,https://github.com/jMonkeyEngine/jmonkeyengine,A complete 3-D game development suite written in Java.,Java,4176,1164,2014-03-20T22:29:28Z,2026-03-25T21:22:01Z,209,894
jishenghua/jshERP,jishenghua,https://github.com/jishenghua/jshERP,管伊佳ERP（原名华夏ERP）基于SpringBoot框架和SaaS模式，立志为中小企业提供开源好用的ERP软件，目前专注进销存+财务功能。主要模块有零售管理、采购管理、销售管理、仓库管理、财务管理、报表查询、系统管理等。支持预付款、收入支出、仓库调拨、组装拆卸、订单等特色功能。拥有库存状况、出入库统计等报表。同时对角色和权限进行了细致全面控制，精确到每个按钮和菜单。,Java,4171,1399,2016-09-20T04:51:39Z,2026-03-26T03:14:19Z,67,36
bingoogolapple/BGABanner-Android,bingoogolapple,https://github.com/bingoogolapple/BGABanner-Android,引导界面滑动导航 + 大于等于1页时无限轮播 + 各种切换动画轮播效果,Java,4167,779,2014-10-25T17:15:18Z,2026-03-20T18:34:27Z,54,167
googlesamples/mlkit,googlesamples,https://github.com/googlesamples/mlkit,A collection of sample apps to demonstrate how to use Google's ML Kit APIs on Android and iOS,Java,4162,3092,2020-05-28T21:40:38Z,2026-03-25T08:14:33Z,194,665
pedrovgs/AndroidWiFiADB,pedrovgs,https://github.com/pedrovgs/AndroidWiFiADB,"IntelliJ/AndroidStudio plugin which provides a button to connect your Android device over WiFi to install, run and debug your applications without a USB connected.",Java,4158,477,2015-10-18T21:58:45Z,2026-03-25T16:06:50Z,23,39
lilishop/lilishop,lilishop,https://github.com/lilishop/lilishop,开源商城 JAVA商城 多语言商城 分销商城  uniapp商城 小程序商城  SAAS商城 ,Java,4136,1010,2021-05-14T01:28:51Z,2026-03-25T13:37:03Z,10,10
JFormDesigner/FlatLaf,JFormDesigner,https://github.com/JFormDesigner/FlatLaf,FlatLaf - Swing Look and Feel (with Darcula/IntelliJ themes support),Java,4130,323,2019-08-19T10:27:05Z,2026-03-25T09:19:47Z,75,876
pqpo/SmartCropper,pqpo,https://github.com/pqpo/SmartCropper,🔥 A library for cropping image in a smart way that can identify the border and correct the cropped image.    智能图片裁剪框架。自动识别边框，手动调节选区，使用透视变换裁剪并矫正选区；适用于身份证，名片，文档等照片的裁剪。,Java,4126,757,2017-08-03T11:08:41Z,2026-03-26T03:27:59Z,38,103
lukas-krecan/ShedLock,lukas-krecan,https://github.com/lukas-krecan/ShedLock,Distributed lock for your scheduled tasks,Java,4121,563,2016-12-11T13:53:59Z,2026-03-25T21:51:22Z,21,413
gh0stkey/HaE,gh0stkey,https://github.com/gh0stkey/HaE,"HaE - Highlighter and Extractor, Empower ethical hacker for efficient operations.",Java,4117,301,2020-03-24T10:12:50Z,2026-03-26T02:46:41Z,0,257
bitcoin-wallet/bitcoin-wallet,bitcoin-wallet,https://github.com/bitcoin-wallet/bitcoin-wallet,"Bitcoin Wallet app for your Android device. Standalone Bitcoin node, no centralized backend required.",Java,4112,2274,2012-03-31T17:06:47Z,2026-03-25T08:24:40Z,0,0
dinuscxj/LoadingDrawable,dinuscxj,https://github.com/dinuscxj/LoadingDrawable,"Some beautiful android loading drawable, can be combined with any view as the LoadingView or the ProgressBar. Besides, some Drawable can customize the loading progress too.",Java,4106,638,2016-04-16T07:33:57Z,2026-03-26T02:39:47Z,10,11
DTStack/chunjun,DTStack,https://github.com/DTStack/chunjun,A data integration framework,Java,4105,1693,2018-04-03T12:44:58Z,2026-03-26T00:37:51Z,279,950
alibaba/Tangram-Android,alibaba,https://github.com/alibaba/Tangram-Android,"Tangram is a modular UI solution for building native page dynamically including Tangram for Android, Tangram for iOS and even backend CMS. This project provides the sdk on Android.",Java,4103,523,2017-03-29T13:29:57Z,2026-03-25T05:37:06Z,72,126
code4craft/tiny-spring,code4craft,https://github.com/code4craft/tiny-spring,A tiny IoC container refer to Spring.,Java,4088,1806,2014-01-10T16:37:57Z,2026-03-22T03:53:56Z,24,3
qunarcorp/bistoury,qunarcorp,https://github.com/qunarcorp/bistoury,Bistoury是去哪儿网的java应用生产问题诊断工具，提供了一站式的问题诊断方案,Java,4087,840,2019-08-01T07:54:25Z,2026-03-18T15:29:01Z,57,49
Manabu-GT/ExpandableTextView,Manabu-GT,https://github.com/Manabu-GT/ExpandableTextView,Android's TextView that can expand/collapse like the Google Play's app description,Java,4077,788,2014-05-17T19:40:15Z,2026-03-18T12:26:25Z,40,21
oblac/jodd,oblac,https://github.com/oblac/jodd,Jodd! Lightweight. Java. Zero dependencies. Use what you like.,Java,4075,721,2012-09-07T20:26:48Z,2026-03-25T08:34:55Z,2,514
orhanobut/hawk,orhanobut,https://github.com/orhanobut/hawk,"✔️ Secure, simple key-value storage for Android",Java,4072,397,2015-02-19T22:25:23Z,2026-03-13T18:50:34Z,46,132
rubensousa/ViewPagerCards,rubensousa,https://github.com/rubensousa/ViewPagerCards,ViewPager cards inspired by Duolingo,Java,4069,605,2016-08-20T15:24:12Z,2026-03-23T13:41:20Z,15,14
jetty/jetty.project,jetty,https://github.com/jetty/jetty.project,"Eclipse Jetty® - Web Container & Clients - supports HTTP/3, HTTP/2, HTTP/1, websocket, servlets, and more",Java,4068,1989,2011-07-14T01:11:57Z,2026-03-26T00:36:21Z,231,6319
RipMeApp/ripme,RipMeApp,https://github.com/RipMeApp/ripme,Downloads albums from the web in bulk for archive purposes,Java,4062,659,2017-01-06T17:12:09Z,2026-03-25T20:29:09Z,503,866
camunda/camunda,camunda,https://github.com/camunda/camunda,Process Orchestration Framework,Java,4055,751,2016-03-20T03:38:04Z,2026-03-26T03:24:38Z,2132,13227
knowm/XChange,knowm,https://github.com/knowm/XChange,XChange is a Java library providing a streamlined API for interacting with 60+ Bitcoin and Altcoin exchanges providing a consistent interface for trading and accessing market data.,Java,4050,2008,2012-02-02T10:48:28Z,2026-03-26T01:51:19Z,305,1479
tronprotocol/java-tron,tronprotocol,https://github.com/tronprotocol/java-tron,Java implementation of the Tron whitepaper,Java,4047,1639,2017-12-26T10:20:38Z,2026-03-26T03:20:45Z,34,1697
luckybilly/CC,luckybilly,https://github.com/luckybilly/CC,业界首个支持渐进式组件化改造的Android组件化开源框架，支持跨进程调用。Componentize your android project gradually.,Java,4046,633,2017-11-23T16:26:33Z,2026-03-26T03:16:20Z,26,140
Creators-of-Create/Create,Creators-of-Create,https://github.com/Creators-of-Create/Create,[NeoForge Mod] Building Tools and Aesthetic Technology,Java,4036,1249,2019-07-18T08:27:10Z,2026-03-25T13:52:57Z,1047,7822
uber/NullAway,uber,https://github.com/uber/NullAway,A tool to help eliminate NullPointerExceptions (NPEs) in your Java code with low build-time overhead,Java,4023,330,2017-09-01T17:35:57Z,2026-03-25T16:30:31Z,133,412
xcltapestry/XCL-Charts,xcltapestry,https://github.com/xcltapestry/XCL-Charts,"Android图表库(XCL-Charts is a free charting library for Android platform.),基于Android Canvas来绘制各种图表,使用简便,定制灵活。目前支持3D/非3D/背向式/横向/竖向柱形图(Bar Chart)、3D/非3D饼图(Pie Chart)、堆叠图(Stacked Bar Chart)、面积图(Area Chart)、 折线图(Line Chart)、曲线图(Spline Chart)、环形图(Dount Chart)、南丁格尔玫瑰图(Rose Chart)、仪表盘(Dial Chart)、刻度盘(Gauge Chart)、雷达图(Radar Chart)、漏斗图(Funnel Chart)、圆形图(Circle Chart)、弧线比较图、散点图(Scatter Chart)、气泡图(Bubble Chart)、范围条形图(RangeBar Chart)等图表。其它特性还包括支持图表缩放、手势移动、点击响应、动画效果、多轴显示、图表参考线、混合图表及同数据源不同图表类型切换等。",Java,4021,1125,2014-06-09T15:44:50Z,2026-03-18T12:26:26Z,10,7
