nameWithOwner,owner,url,description,primaryLanguage,stars,forks,createdAt,updatedAt,openIssues,closedIssues
Snailclimb/JavaGuide,Snailclimb,https://github.com/Snailclimb/JavaGuide,Java 面试 & 后端通用面试指南，覆盖计算机基础、数据库、分布式、高并发与系统设计。准备后端技术面试，首选 JavaGuide！,Java,154478,46134,2018-05-07T13:27:00Z,2026-03-26T03:28:13Z,67,1067
krahets/hello-algo,krahets,https://github.com/krahets/hello-algo,"《Hello 算法》：动画图解、一键运行的数据结构与算法教程。支持简中、繁中、English、日本語，提供 Python, Java, C++, C, C#, JS, Go, Swift, Rust, Ruby, Kotlin, TS, Dart 等代码实现",Java,123944,14947,2022-11-04T11:08:34Z,2026-03-26T03:19:07Z,9,274
GrowingGit/GitHub-Chinese-Top-Charts,GrowingGit,https://github.com/GrowingGit/GitHub-Chinese-Top-Charts,:cn: GitHub中文排行榜，各语言分设「软件 | 资料」榜单，精准定位中文好项目。各取所需，高效学习。,Java,107084,13528,2019-09-05T03:01:56Z,2026-03-26T03:15:41Z,184,162
iluwatar/java-design-patterns,iluwatar,https://github.com/iluwatar/java-design-patterns,Design patterns implemented in Java,Java,93835,27370,2014-08-09T16:45:18Z,2026-03-25T22:27:40Z,140,840
macrozheng/mall,macrozheng,https://github.com/macrozheng/mall,mall项目是一套电商系统，包括前台商城系统及后台管理系统，基于Spring Boot+MyBatis实现，采用Docker容器化部署。 前台商城系统包含首页门户、商品推荐、商品搜索、商品展示、购物车、订单流程、会员中心、客户服务、帮助中心等模块。 后台管理系统包含商品管理、订单管理、会员管理、促销管理、运营管理、内容管理、统计报表、财务管理、权限管理、设置等模块。,Java,83238,29678,2018-04-04T01:11:44Z,2026-03-26T01:44:28Z,10,490
spring-projects/spring-boot,spring-projects,https://github.com/spring-projects/spring-boot,"Spring Boot helps you to create Spring-powered, production-grade applications and services with absolute minimum fuss.",Java,80309,41862,2012-10-19T15:02:57Z,2026-03-26T02:21:41Z,468,41241
doocs/advanced-java,doocs,https://github.com/doocs/advanced-java,😮 Core Interview Questions & Answers For Experienced Java(Backend) Developers | 互联网 Java 工程师进阶知识完全扫盲：涵盖高并发、分布式、高可用、微服务、海量数据处理等领域知识,Java,78917,19269,2018-10-06T11:38:30Z,2026-03-26T03:16:06Z,1,148
MisterBooo/LeetCodeAnimation,MisterBooo,https://github.com/MisterBooo/LeetCodeAnimation,Demonstrate all the questions on LeetCode in the form of animation.（用动画的形式呈现解LeetCode题目的思路）,Java,76699,13977,2018-12-06T08:01:22Z,2026-03-25T16:52:18Z,18,43
elastic/elasticsearch,elastic,https://github.com/elastic/elasticsearch,"Free and Open Source, Distributed, RESTful Search Engine",Java,76395,25827,2010-02-08T13:20:56Z,2026-03-26T03:19:27Z,4502,38923
NationalSecurityAgency/ghidra,NationalSecurityAgency,https://github.com/NationalSecurityAgency/ghidra,Ghidra is a software reverse engineering (SRE) framework,Java,66154,7291,2019-03-01T03:27:48Z,2026-03-26T03:24:48Z,1536,4355
TheAlgorithms/Java,TheAlgorithms,https://github.com/TheAlgorithms/Java,All Algorithms implemented in Java,Java,65280,21038,2016-07-16T10:21:02Z,2026-03-25T23:56:45Z,31,1181
kdn251/interviews,kdn251,https://github.com/kdn251/interviews,Everything you need to know to get the job.,Java,64935,12922,2017-02-14T18:19:25Z,2026-03-25T18:27:51Z,34,24
spring-projects/spring-framework,spring-projects,https://github.com/spring-projects/spring-framework,Spring Framework,Java,59787,38902,2010-12-08T04:04:45Z,2026-03-26T03:18:22Z,313,27665
termux/termux-app,termux,https://github.com/termux/termux-app,Termux - a terminal emulator application for Android OS extendible by variety of packages.,Java,52482,6276,2015-10-23T09:42:46Z,2026-03-26T03:29:49Z,442,2600
google/guava,google,https://github.com/google/guava,Google core libraries for Java,Java,51504,11153,2014-05-29T16:23:17Z,2026-03-26T00:40:23Z,619,3032
dbeaver/dbeaver,dbeaver,https://github.com/dbeaver/dbeaver,Free universal database tool and SQL client,Java,49279,4088,2015-10-21T08:26:28Z,2026-03-26T03:23:33Z,3179,16891
ReactiveX/RxJava,ReactiveX,https://github.com/ReactiveX/RxJava,RxJava – Reactive Extensions for the JVM – a library for composing asynchronous and event-based programs using observable sequences for the Java VM.,Java,48469,7602,2013-01-08T20:11:48Z,2026-03-25T23:52:56Z,16,3245
skylot/jadx,skylot,https://github.com/skylot/jadx,Dex to Java decompiler,Java,47788,5467,2013-03-18T17:08:21Z,2026-03-26T02:39:01Z,411,1645
jeecgboot/JeecgBoot,jeecgboot,https://github.com/jeecgboot/JeecgBoot,"一款 AI 驱动的低代码平台，提供""零代码""与""代码生成""双模式——零代码模式一句话搭建系统，代码生成模式自动输出前后端代码与建表 SQL，生成即可运行。平台内置 AI 聊天助手、AI大模型、知识库、AI流程编排、MCP 与插件体系，兼容主流大模型，支持一句话生成流程图、设计表单、聊天式业务操作，解决 Java 项目 80% 重复工作，高效且不失灵活。",Java,45569,15853,2018-11-26T10:40:00Z,2026-03-26T02:29:19Z,49,8169
apache/dubbo,apache,https://github.com/apache/dubbo,The java implementation of Apache Dubbo. An RPC and microservice framework.,Java,41712,26530,2012-06-19T07:56:02Z,2026-03-26T02:00:37Z,815,6565
PhilJay/MPAndroidChart,PhilJay,https://github.com/PhilJay/MPAndroidChart,"A powerful 🚀 Android chart view / graph view library, supporting line- bar- pie- radar- bubble- and candlestick charts as well as scaling, panning and animations.",Java,38227,9046,2014-04-25T14:29:47Z,2026-03-25T16:07:06Z,2067,2898
halo-dev/halo,halo-dev,https://github.com/halo-dev/halo,强大易用的开源建站工具。,Java,38147,10232,2018-03-21T12:56:52Z,2026-03-26T03:07:10Z,234,4365
TeamNewPipe/NewPipe,TeamNewPipe,https://github.com/TeamNewPipe/NewPipe,A libre lightweight streaming front-end for Android.,Java,37651,3520,2015-09-03T23:39:26Z,2026-03-26T02:04:27Z,1343,8809
eugenp/tutorials,eugenp,https://github.com/eugenp/tutorials,Getting Started with Spring Boot 3: ,Java,37350,53720,2013-04-29T18:26:36Z,2026-03-26T01:22:47Z,18,773
alibaba/arthas,alibaba,https://github.com/alibaba/arthas,Alibaba Java Diagnostic Tool Arthas/Alibaba Java诊断利器Arthas,Java,37212,7635,2018-08-29T17:15:57Z,2026-03-25T05:27:18Z,375,1759
geekxh/hello-algorithm,geekxh,https://github.com/geekxh/hello-algorithm,🌍 针对小白的算法训练 | 包括四部分：①.大厂面经 ②.力扣图解  ③.千本开源电子书 ④.百张技术思维导图（项目花了上百小时，希望可以点 star 支持，🌹感谢~）推荐免费ChatGPT使用网站,Java,36034,6446,2020-05-29T05:47:09Z,2026-03-26T03:09:34Z,11,33
YunaiV/ruoyi-vue-pro,YunaiV,https://github.com/YunaiV/ruoyi-vue-pro,🔥 官方推荐 🔥 RuoYi-Vue 全新 Pro 版本，优化重构所有功能。基于 Spring Boot + MyBatis Plus + Vue & Element 实现的后台管理系统 + 微信小程序，支持 RBAC 动态权限、数据权限、SaaS 多租户、Flowable 工作流、三方登录、支付、短信、商城、CRM、ERP、AI 大模型、IoT 物联网等功能。你的 ⭐️ Star ⭐️，是作者生发的动力！,Java,36023,7780,2021-01-24T03:18:25Z,2026-03-26T03:29:18Z,3,743
doocs/leetcode,doocs,https://github.com/doocs/leetcode,🔥LeetCode solutions in any programming language | 多种编程语言实现 LeetCode、《剑指 Offer（第 2 版）》、《程序员面试金典（第 6 版）》题解,Java,35822,9380,2018-09-16T14:03:03Z,2026-03-25T23:58:18Z,0,59
airbnb/lottie-android,airbnb,https://github.com/airbnb/lottie-android,"Render After Effects animations natively on Android and iOS, Web, and React Native",Java,35602,5438,2016-10-06T22:42:42Z,2026-03-25T16:07:13Z,49,1753
ashishps1/awesome-system-design-resources,ashishps1,https://github.com/ashishps1/awesome-system-design-resources,Learn System Design concepts and prepare for interviews using free resources.,Java,35520,7772,2023-10-25T01:50:42Z,2026-03-26T03:09:06Z,5,26
bumptech/glide,bumptech,https://github.com/bumptech/glide,An image loading and caching library for Android focused on smooth scrolling,Java,35031,6182,2013-07-08T22:52:33Z,2026-03-25T18:44:20Z,583,3935
netty/netty,netty,https://github.com/netty/netty,Netty project - an event-driven asynchronous network application framework,Java,34898,16268,2010-11-09T09:22:21Z,2026-03-25T17:29:19Z,566,6290
SeleniumHQ/selenium,SeleniumHQ,https://github.com/SeleniumHQ/selenium,A browser automation framework and ecosystem.,Java,34177,8667,2013-01-14T21:40:56Z,2026-03-26T01:23:17Z,114,11033
xkcoding/spring-boot-demo,xkcoding,https://github.com/xkcoding/spring-boot-demo,🚀一个用来深入学习并实战 Spring Boot 的项目。,Java,34112,10993,2017-11-10T06:27:29Z,2026-03-25T16:47:01Z,100,74
zxing/zxing,zxing,https://github.com/zxing/zxing,"ZXing (""Zebra Crossing"") barcode scanning library for Java, Android",Java,33901,9433,2011-10-12T14:07:27Z,2026-03-26T02:37:38Z,5,1336
alibaba/easyexcel,alibaba,https://github.com/alibaba/easyexcel,快速、简洁、解决大文件内存溢出的java处理Excel工具,Java,33770,7622,2018-02-06T03:14:08Z,2026-03-25T07:57:45Z,489,3131
Blankj/AndroidUtilCode,Blankj,https://github.com/Blankj/AndroidUtilCode,:fire: Android developers should collect the following utils(updating).,Java,33707,10681,2016-07-30T18:18:32Z,2026-03-26T03:19:48Z,312,1284
keycloak/keycloak,keycloak,https://github.com/keycloak/keycloak,Open Source Identity and Access Management For Modern Applications and Services,Java,33570,8172,2013-07-02T13:38:51Z,2026-03-26T01:45:41Z,2237,15575
alibaba/nacos,alibaba,https://github.com/alibaba/nacos,"an easy-to-use dynamic service discovery, configuration and service management platform for building AI cloud native applications.",Java,32764,13260,2018-06-15T06:49:27Z,2026-03-26T02:08:23Z,209,9315
binarywang/WxJava,binarywang,https://github.com/binarywang/WxJava,微信开发 Java SDK ，支持包括微信支付，开放平台，小程序，企业微信，视频号，公众号等的后端开发,Java,32670,9059,2016-01-06T08:24:05Z,2026-03-26T02:30:22Z,7,2464
apache/kafka,apache,https://github.com/apache/kafka,Apache Kafka - A distributed event streaming platform,Java,32228,15067,2011-08-15T18:06:16Z,2026-03-26T02:50:24Z,0,0
conductor-oss/conductor,conductor-oss,https://github.com/conductor-oss/conductor,Conductor is an event driven agentic orchestration platform providing durable and highly resilient execution engine for applications and AI Agents,Java,31567,840,2023-12-08T06:06:09Z,2026-03-26T03:29:37Z,105,166
ityouknow/spring-boot-examples,ityouknow,https://github.com/ityouknow/spring-boot-examples,about learning Spring Boot via examples. Spring Boot 教程、技术栈示例代码，快速简单上手教程。 ,Java,30640,12300,2016-11-05T05:32:33Z,2026-03-24T07:29:17Z,10,100
chinabugotech/hutool,chinabugotech,https://github.com/chinabugotech/hutool,🍬A set of tools that keep Java sweet.,Java,30332,7645,2014-04-13T07:23:51Z,2026-03-26T02:23:05Z,2,3093
xuxueli/xxl-job,xuxueli,https://github.com/xuxueli/xxl-job,A distributed task scheduling framework.（分布式任务调度平台XXL-JOB）,Java,29993,11455,2015-11-28T12:59:34Z,2026-03-26T03:21:58Z,139,3207
apolloconfig/apollo,apolloconfig,https://github.com/apolloconfig/apollo,Apollo is a reliable configuration management system suitable for microservice configuration management scenarios.,Java,29768,10202,2016-03-04T10:24:23Z,2026-03-26T02:33:29Z,145,3258
alibaba/canal,alibaba,https://github.com/alibaba/canal,阿里巴巴 MySQL binlog 增量订阅&消费组件 ,Java,29645,7660,2013-01-13T10:59:52Z,2026-03-25T14:57:25Z,1176,3615
alibaba/spring-cloud-alibaba,alibaba,https://github.com/alibaba/spring-cloud-alibaba,Spring Cloud Alibaba provides a one-stop solution for application development for the distributed solutions of Alibaba middleware.,Java,29082,8515,2017-12-01T20:49:15Z,2026-03-26T02:28:10Z,108,2487
yuliskov/SmartTube,yuliskov,https://github.com/yuliskov/SmartTube,Browse media content with your own rules on Android TV,Java,29082,1559,2020-07-28T12:53:52Z,2026-03-26T03:08:20Z,640,3251
wuyouzhuguli/SpringAll,wuyouzhuguli,https://github.com/wuyouzhuguli/SpringAll,循序渐进，学习Spring Boot、Spring Boot & Shiro、Spring Batch、Spring Cloud、Spring Cloud Alibaba、Spring Security & Spring Security OAuth2，博客Spring系列源码：https://mrbird.cc,Java,29011,8155,2018-05-02T02:48:44Z,2026-03-25T16:50:06Z,21,27
DrKLO/Telegram,DrKLO,https://github.com/DrKLO/Telegram,Telegram for Android source,Java,28758,9351,2013-10-25T14:08:10Z,2026-03-25T21:51:57Z,0,0
alibaba/druid,alibaba,https://github.com/alibaba/druid,阿里云计算平台DataWorks(https://help.aliyun.com/document_detail/137663.html) 团队出品，为监控而生的数据库连接池,Java,28217,8602,2011-11-03T05:12:51Z,2026-03-25T10:07:31Z,2297,2294
lenve/vhr,lenve,https://github.com/lenve/vhr,微人事是一个前后端分离的人力资源管理系统，项目采用SpringBoot+Vue开发。,Java,28097,10252,2018-01-04T08:57:51Z,2026-03-26T02:48:08Z,157,99
Anuken/Mindustry,Anuken,https://github.com/Anuken/Mindustry,The automation tower defense RTS,Java,27026,3380,2017-04-30T01:24:29Z,2026-03-26T00:30:48Z,0,5264
crossoverJie/JCSprout,crossoverJie,https://github.com/crossoverJie/JCSprout,"👨‍🎓 Java Core Sprout : basic, concurrent, algorithm ",Java,27002,7022,2017-12-17T09:06:50Z,2026-03-25T16:53:56Z,30,59
qiurunze123/miaosha,qiurunze123,https://github.com/qiurunze123/miaosha,⭐⭐⭐⭐秒杀系统设计与实现.互联网工程师进阶与分析🙋🐓,Java,26604,6618,2018-09-14T04:36:24Z,2026-03-25T17:21:25Z,4,81
kestra-io/kestra,kestra-io,https://github.com/kestra-io/kestra,Event Driven Orchestration & Scheduling Platform for Mission Critical Applications,Java,26592,2532,2019-08-24T13:56:15Z,2026-03-26T01:37:00Z,412,4973
OpenAPITools/openapi-generator,OpenAPITools,https://github.com/OpenAPITools/openapi-generator,"OpenAPI Generator allows generation of API client libraries (SDK generation), server stubs, documentation and configuration automatically given an OpenAPI Spec (v2, v3)",Java,26023,7457,2018-05-12T09:57:56Z,2026-03-26T02:23:00Z,5075,4690
apache/incubator-seata,apache,https://github.com/apache/incubator-seata,":fire: Seata is an easy-to-use, high-performance, open source distributed transaction solution.",Java,25966,8890,2018-12-28T08:37:22Z,2026-03-25T16:43:22Z,795,3490
apache/flink,apache,https://github.com/apache/flink,Apache Flink,Java,25893,13906,2014-06-07T07:00:10Z,2026-03-26T03:24:41Z,0,0
alibaba/fastjson,alibaba,https://github.com/alibaba/fastjson,"FASTJSON 2.0.x has been released, faster and more secure, recommend you upgrade.",Java,25702,6446,2011-11-03T06:58:52Z,2026-03-25T10:07:57Z,1935,1694
hollischuang/toBeTopJavaer,hollischuang,https://github.com/hollischuang/toBeTopJavaer,To Be Top Javaer - Java工程师成神之路,Java,25457,5412,2018-10-25T09:54:54Z,2026-03-24T09:15:02Z,58,71
JakeWharton/butterknife,JakeWharton,https://github.com/JakeWharton/butterknife,Bind Android views and callbacks to fields and methods.,Java,25413,4565,2013-03-05T08:18:59Z,2026-03-25T16:06:56Z,102,1091
CodePhiliaX/Chat2DB,CodePhiliaX,https://github.com/CodePhiliaX/Chat2DB,"AI-driven database tool and SQL client, The hottest GUI client, supporting MySQL, Oracle, PostgreSQL, DB2, SQL Server, DB2, SQLite, H2, ClickHouse, and more.",Java,25283,2764,2023-06-20T14:05:26Z,2026-03-26T02:55:58Z,474,724
bazelbuild/bazel,bazelbuild,https://github.com/bazelbuild/bazel,"a fast, scalable, multi-language and extensible build system",Java,25262,4429,2014-06-12T16:00:38Z,2026-03-25T20:55:47Z,1595,14676
scwang90/SmartRefreshLayout,scwang90,https://github.com/scwang90/SmartRefreshLayout,🔥下拉刷新、上拉加载、二级刷新、淘宝二楼、RefreshLayout、OverScroll，Android智能下拉刷新框架，支持越界回弹、越界拖动，具有极强的扩展性，集成了几十种炫酷的Header和 Footer。,Java,25174,4976,2017-06-02T09:52:50Z,2026-03-26T03:20:06Z,337,1237
jenkinsci/jenkins,jenkinsci,https://github.com/jenkinsci/jenkins,Jenkins automation server,Java,25128,9432,2010-11-22T21:21:23Z,2026-03-25T21:30:58Z,3432,11082
libgdx/libgdx,libgdx,https://github.com/libgdx/libgdx,Desktop/Android/HTML5/iOS Java game development framework,Java,24947,6533,2012-08-10T19:34:38Z,2026-03-25T21:22:04Z,248,3609
proxyee-down-org/proxyee-down,proxyee-down-org,https://github.com/proxyee-down-org/proxyee-down,http下载工具，基于http代理，支持多连接分块下载,Java,24787,4377,2017-10-25T10:07:27Z,2026-03-25T15:53:34Z,0,0
apache/skywalking,apache,https://github.com/apache/skywalking,"APM, Application Performance Monitoring System",Java,24760,6640,2015-11-07T03:30:36Z,2026-03-26T03:10:35Z,37,5664
greenrobot/EventBus,greenrobot,https://github.com/greenrobot/EventBus,"Event bus for Android and Java that simplifies communication between Activities, Fragments, Threads, Services, etc. Less code, better quality.",Java,24749,4649,2012-07-16T16:55:40Z,2026-03-26T03:23:55Z,102,490
Netflix/Hystrix,Netflix,https://github.com/Netflix/Hystrix,"Hystrix is a latency and fault tolerance library designed to isolate points of access to remote systems, services and 3rd party libraries, stop cascading failure and enable resilience in complex distributed systems where failure is inevitable.",Java,24467,4705,2012-11-19T20:14:46Z,2026-03-25T11:12:30Z,2,1039
google/gson,google,https://github.com/google/gson,A Java serialization/deserialization library to convert Java Objects into JSON and back,Java,24347,4417,2015-03-19T18:21:20Z,2026-03-25T16:06:43Z,233,1427
redisson/redisson,redisson,https://github.com/redisson/redisson,"Redisson - Valkey & Redis Java client. Real-Time Data Platform. Sync/Async/RxJava/Reactive API. Over 50 Valkey and Redis based Java objects and services: Set, Multimap, SortedSet, Map, List, Queue, Deque, Semaphore, Lock, AtomicLong, Map Reduce, Bloom filter, Spring, Tomcat, Scheduler, JCache API, Hibernate, RPC, local cache..",Java,24276,5496,2014-01-11T14:06:25Z,2026-03-26T02:46:14Z,232,5505
iBotPeaches/Apktool,iBotPeaches,https://github.com/iBotPeaches/Apktool,A tool for reverse engineering Android apk files,Java,24141,3897,2012-03-19T17:46:53Z,2026-03-26T02:15:21Z,76,2911
dataease/dataease,dataease,https://github.com/dataease/dataease,🔥 人人可用的开源 BI 工具，数据可视化神器。An open-source BI tool alternative to Tableau.,Java,23675,4059,2021-02-02T04:10:21Z,2026-03-26T02:14:13Z,57,7182
EnterpriseQualityCoding/FizzBuzzEnterpriseEdition,EnterpriseQualityCoding,https://github.com/EnterpriseQualityCoding/FizzBuzzEnterpriseEdition,FizzBuzz Enterprise Edition is a no-nonsense implementation of FizzBuzz made by serious businessmen for serious business purposes.,Java,23568,800,2012-11-24T00:14:41Z,2026-03-26T01:12:36Z,519,92
LSPosed/LSPosed,LSPosed,https://github.com/LSPosed/LSPosed,LSPosed Framework,Java,23229,3536,2020-12-12T08:39:37Z,2026-03-26T03:03:16Z,0,0
doocs/source-code-hunter,doocs,https://github.com/doocs/source-code-hunter,😱 从源码层面，剖析挖掘互联网行业主流技术的底层实现原理，为广大开发者 “提升技术深度” 提供便利。目前开放 Spring 全家桶，Mybatis、Netty、Dubbo 框架，及 Redis、Tomcat 中间件等,Java,23136,4260,2019-10-28T01:35:10Z,2026-03-25T17:17:38Z,0,35
alibaba/Sentinel,alibaba,https://github.com/alibaba/Sentinel,"A powerful flow control component enabling reliability, resilience and monitoring for microservices. (面向云原生微服务的高可用流控防护组件)",Java,23106,8151,2018-04-04T06:37:33Z,2026-03-25T15:15:24Z,701,1644
ashishps1/awesome-low-level-design,ashishps1,https://github.com/ashishps1/awesome-low-level-design,Learn Low Level Design (LLD) and prepare for interviews using free resources.,Java,22913,5633,2023-11-17T10:15:12Z,2026-03-26T03:19:32Z,39,31
openjdk/jdk,openjdk,https://github.com/openjdk/jdk,JDK main-line development https://openjdk.org/projects/jdk,Java,22735,6287,2018-09-17T12:29:20Z,2026-03-26T02:33:34Z,0,0
apache/rocketmq,apache,https://github.com/apache/rocketmq,"Apache RocketMQ is a cloud native messaging and streaming platform, making it simple to build event-driven applications.",Java,22387,11991,2016-11-30T08:00:08Z,2026-03-26T03:03:18Z,178,4725
kunal-kushwaha/DSA-Bootcamp-Java,kunal-kushwaha,https://github.com/kunal-kushwaha/DSA-Bootcamp-Java,"This repository consists of the code samples, assignments, and notes for the Java data structures & algorithms + interview preparation bootcamp of WeMakeDevs.",Java,22375,13210,2021-07-30T12:23:25Z,2026-03-25T18:48:24Z,207,178
google/ExoPlayer,google,https://github.com/google/ExoPlayer,This project is deprecated and stale. The latest ExoPlayer code is available in https://github.com/androidx/media,Java,21935,6014,2014-06-13T21:19:18Z,2026-03-25T18:20:14Z,623,9525
elunez/eladmin,elunez,https://github.com/elunez/eladmin,eladmin jpa 版本：项目基于 Spring Boot 2.7.18、 Jpa、 Spring Security、Redis、Vue的前后端分离的后台管理系统，项目采用分模块开发方式， 权限控制采用 RBAC，支持数据字典与数据权限管理，支持一键生成前后端代码，支持动态路由,Java,21934,7372,2018-12-14T08:54:24Z,2026-03-25T09:55:14Z,6,692
oracle/graal,oracle,https://github.com/oracle/graal,"GraalVM compiles applications into native executables that start instantly, scale fast, and use fewer compute resources 🚀",Java,21529,1784,2016-01-14T17:11:35Z,2026-03-26T03:21:15Z,669,3910
CarGuo/GSYVideoPlayer,CarGuo,https://github.com/CarGuo/GSYVideoPlayer,"Video players (IJKplayer, ExoPlayer, MediaPlayer), HTTPS, 16k page size, danmaku (bullet chat) support, external subtitles, support for filters, watermarks, and GIF screenshots, pre-roll and mid-roll ads, multiple simultaneous playback, basic seeking/dragging, volume and brightness adjustment, play-while-cache support",Java,21431,4324,2016-11-13T12:34:31Z,2026-03-26T03:10:38Z,12,3898
thingsboard/thingsboard,thingsboard,https://github.com/thingsboard/thingsboard,"Open-source IoT Platform - Device management, data collection, processing and visualization.",Java,21421,6199,2016-12-01T09:33:30Z,2026-03-26T03:26:15Z,94,7894
brettwooldridge/HikariCP,brettwooldridge,https://github.com/brettwooldridge/HikariCP,"光 HikariCP・A solid, high-performance, JDBC connection pool at last.",Java,21076,3013,2013-10-08T05:43:03Z,2026-03-25T22:10:14Z,511,1410
apache/shardingsphere,apache,https://github.com/apache/shardingsphere,"Empowering Data Intelligence with Distributed SQL for Sharding, Scalability, and Security Across All Databases.",Java,20701,6913,2016-01-18T12:49:26Z,2026-03-26T02:19:07Z,305,11557
didi/DoKit,didi,https://github.com/didi/DoKit,一款面向泛前端产品研发全生命周期的效率平台。,Java,20433,3190,2018-08-14T10:32:07Z,2026-03-25T15:54:34Z,244,490
mybatis/mybatis-3,mybatis,https://github.com/mybatis/mybatis-3,MyBatis SQL mapper framework for Java,Java,20401,12945,2013-02-14T19:03:32Z,2026-03-26T02:04:16Z,128,1254
linlinjava/litemall,linlinjava,https://github.com/linlinjava/litemall,又一个小商城。litemall = Spring Boot后端 + Vue管理员前端 + 微信小程序用户前端 + Vue用户移动端,Java,20206,7338,2018-03-22T16:42:30Z,2026-03-26T01:20:02Z,44,332
ReactiveX/RxAndroid,ReactiveX,https://github.com/ReactiveX/RxAndroid,RxJava bindings for Android,Java,20181,2945,2014-08-19T03:46:38Z,2026-03-24T15:22:45Z,1,351
yudaocode/SpringBoot-Labs,yudaocode,https://github.com/yudaocode/SpringBoot-Labs,一个涵盖六个专栏：Spring Boot 2.X、Spring Cloud、Spring Cloud Alibaba、Dubbo、分布式消息队列、分布式事务的仓库。希望胖友小手一抖，右上角来个 Star，感恩 1024,Java,20078,6180,2018-09-12T14:51:46Z,2026-03-25T12:53:04Z,29,16
JetBrains/intellij-community,JetBrains,https://github.com/JetBrains/intellij-community,IntelliJ IDEA & IntelliJ Platform,Java,19872,5707,2011-09-30T13:33:05Z,2026-03-26T02:33:33Z,0,0
dianping/cat,dianping,https://github.com/dianping/cat,"CAT 作为服务端项目基础组件，提供了 Java, C/C++, Node.js, Python, Go 等多语言客户端，已经在美团点评的基础架构中间件框架（MVC框架，RPC框架，数据库框架，缓存框架等，消息队列，配置系统等）深度集成，为美团点评各业务线提供系统丰富的性能指标、健康状况、实时告警等。",Java,18969,5424,2012-12-05T02:31:48Z,2026-03-26T03:01:07Z,194,1086
lionsoul2014/ip2region,lionsoul2014,https://github.com/lionsoul2014/ip2region,"Ip2region is an offline IP-to-Region localization library and IP data management framework with both IPv4 and IPv6 supports, 10-microsecond level query efficiency, xdb search client for many programming languages",Java,18868,2987,2015-11-02T00:43:13Z,2026-03-25T19:31:12Z,2,276
Baseflow/PhotoView,Baseflow,https://github.com/Baseflow/PhotoView,"Implementation of ImageView for Android that supports zooming, by various touch gestures.",Java,18858,3923,2012-07-17T16:39:00Z,2026-03-25T22:33:15Z,211,478
antlr/antlr4,antlr,https://github.com/antlr/antlr4,"ANTLR (ANother Tool for Language Recognition) is a powerful parser generator for reading, processing, executing, or translating structured text or binary files.",Java,18802,3427,2010-02-04T01:36:28Z,2026-03-25T07:39:13Z,894,1519
