nameWithOwner,owner,url,description,primaryLanguage,stars,forks,createdAt,updatedAt,openIssues,closedIssues
StarRocks/starrocks,StarRocks,https://github.com/StarRocks/starrocks,"The world's fastest open query engine for sub-second analytics both on and off the data lakehouse. With the flexibility to support nearly any scenario, StarRocks provides best-in-class performance for multi-dimensional analytics, real-time analytics, and ad-hoc queries. A Linux Foundation project.",Java,11514,2371,2021-09-04T02:29:35Z,2026-03-26T03:13:44Z,403,9052
realm/realm-java,realm,https://github.com/realm/realm-java,Realm is a mobile database: a replacement for SQLite & ORMs,Java,11489,1754,2012-04-20T09:18:42Z,2026-03-20T04:58:46Z,362,4234
careercup/CtCI-6th-Edition,careercup,https://github.com/careercup/CtCI-6th-Edition,Cracking the Coding Interview 6th Ed. Solutions,Java,11478,4395,2015-07-02T06:28:46Z,2026-03-25T06:49:50Z,53,22
gyf-dev/ImmersionBar,gyf-dev,https://github.com/gyf-dev/ImmersionBar,android 4.4以上沉浸式状态栏和沉浸式导航栏管理，适配横竖屏切换、刘海屏、软键盘弹出等问题，可以修改状态栏字体颜色和导航栏图标颜色，以及不可修改字体颜色手机的适配，适用于Activity、Fragment、DialogFragment、Dialog，PopupWindow，一句代码轻松实现，以及对bar的其他设置，详见README。简书请参考：http://www.jianshu.com/p/2a884e211a62,Java,11470,1920,2017-04-19T05:10:09Z,2026-03-23T05:31:14Z,133,435
jhy/jsoup,jhy,https://github.com/jhy/jsoup,"jsoup: the Java HTML parser, built for HTML editing, cleaning, scraping, and XSS safety.",Java,11357,2284,2009-12-19T01:29:58Z,2026-03-25T11:38:05Z,2,1595
ssssssss-team/spider-flow,ssssssss-team,https://github.com/ssssssss-team/spider-flow,新一代爬虫平台，以图形化方式定义爬虫流程，不写代码即可完成爬虫。,Java,11317,2178,2020-03-27T11:07:15Z,2026-03-26T02:51:10Z,11,34
mission-peace/interview,mission-peace,https://github.com/mission-peace/interview,Interview questions,Java,11309,5159,2014-07-20T21:27:31Z,2026-03-25T02:13:02Z,61,26
apereo/cas,apereo,https://github.com/apereo/cas,Apereo CAS - Identity & Single Sign On for all earthlings and beyond.,Java,11302,3959,2011-09-09T01:36:42Z,2026-03-26T00:26:16Z,0,0
langchain4j/langchain4j,langchain4j,https://github.com/langchain4j/langchain4j,"LangChain4j is an open-source Java library that simplifies the integration of LLMs into Java applications through a unified API, providing access to popular LLMs and vector databases. It makes implementing RAG, tool calling (including support for MCP), and agents easy. LangChain4j integrates seamlessly with various enterprise Java frameworks.",Java,11299,2065,2023-06-20T15:30:29Z,2026-03-26T03:19:09Z,574,1461
permissions-dispatcher/PermissionsDispatcher,permissions-dispatcher,https://github.com/permissions-dispatcher/PermissionsDispatcher,A declarative API to handle Android runtime permissions.,Java,11204,1437,2015-08-15T21:41:05Z,2026-03-19T16:10:04Z,29,455
daniulive/SmarterStreaming,daniulive,https://github.com/daniulive/SmarterStreaming,业内为数不多致力于极致体验的超强全自研跨平台(windows/linux/android/iOS)流媒体内核，通过模块化自由组合，支持实时RTMP推流、RTSP推流、RTMP播放器、RTSP播放器、录像、多路流媒体转发、音视频导播、动态视频合成、音频混音、直播互动、内置轻量级RTSP服务等，比快更快，业界真正靠谱的超低延迟直播SDK(延迟低至100~200ms)。,Java,11165,2763,2016-03-26T14:46:02Z,2026-03-25T08:31:03Z,7,124
lingochamp/FileDownloader,lingochamp,https://github.com/lingochamp/FileDownloader,Multitask、MultiThread(MultiConnection)、Breakpoint-resume、High-concurrency、Simple to use、Single/NotSingle-process,Java,11124,2209,2015-12-22T11:17:16Z,2026-03-26T03:19:43Z,184,1192
H07000223/FlycoTabLayout,H07000223,https://github.com/H07000223/FlycoTabLayout,An Android TabLayout Lib,Java,11112,2419,2015-11-09T01:53:19Z,2026-03-26T03:21:01Z,357,180
apple/pkl,apple,https://github.com/apple/pkl,A configuration as code language with rich validation and tooling.,Java,11105,364,2024-01-19T17:28:45Z,2026-03-25T18:52:43Z,170,217
jwtk/jjwt,jwtk,https://github.com/jwtk/jjwt,Java JWT: JSON Web Token for Java and Android,Java,11054,1383,2014-09-13T01:06:24Z,2026-03-25T19:54:17Z,30,578
jfeinstein10/SlidingMenu,jfeinstein10,https://github.com/jfeinstein10/SlidingMenu,An Android library that allows you to easily create applications with slide-in menus. You may use it in your Android apps provided that you cite this project and include the license in your app. Thanks!,Java,11025,4969,2012-06-30T05:14:23Z,2026-03-26T01:58:17Z,265,384
androidannotations/androidannotations,androidannotations,https://github.com/androidannotations/androidannotations,Fast Android Development. Easy maintainance.,Java,11008,2324,2012-01-06T08:48:03Z,2026-03-26T03:21:33Z,50,1608
asLody/VirtualApp,asLody,https://github.com/asLody/VirtualApp,Virtual Engine for Android(Support 14.0 in business version),Java,10950,3018,2016-07-06T13:25:23Z,2026-03-26T03:29:05Z,0,0
square/javapoet,square,https://github.com/square/javapoet,A Java API for generating .java source files.,Java,10859,1387,2013-02-01T16:56:30Z,2026-03-25T16:41:10Z,92,324
clojure/clojure,clojure,https://github.com/clojure/clojure,The Clojure programming language,Java,10833,1457,2010-06-29T20:03:33Z,2026-03-25T17:18:02Z,0,0
aosp-mirror/platform_frameworks_base,aosp-mirror,https://github.com/aosp-mirror/platform_frameworks_base,,Java,10823,6479,2008-10-21T18:20:37Z,2026-03-25T07:47:50Z,0,0
TooTallNate/Java-WebSocket,TooTallNate,https://github.com/TooTallNate/Java-WebSocket,A barebones WebSocket client and server implementation written in 100% Java.,Java,10801,2589,2010-01-20T23:33:04Z,2026-03-24T10:16:54Z,43,1038
alibaba/vlayout,alibaba,https://github.com/alibaba/vlayout,"Project vlayout is a powerfull LayoutManager extension for RecyclerView, it provides a group of layouts for RecyclerView. Make it able to handle a complicate situation when grid, list and other layouts in the same recyclerview. ",Java,10761,1788,2017-02-27T08:11:47Z,2026-03-26T03:23:13Z,190,313
zfile-dev/zfile,zfile-dev,https://github.com/zfile-dev/zfile,在线云盘、网盘、OneDrive、云存储、私有云、对象存储、h5ai、上传、下载,Java,10710,1961,2019-08-19T13:57:56Z,2026-03-26T00:32:20Z,55,633
iflytek/astron-agent,iflytek,https://github.com/iflytek/astron-agent,"Enterprise-grade, commercial-friendly agentic workflow platform for building next-generation SuperAgents.",Java,10682,1123,2025-09-19T08:46:01Z,2026-03-26T03:27:47Z,34,183
android-async-http/android-async-http,android-async-http,https://github.com/android-async-http/android-async-http,"An asynchronous, callback-based Http client for Android built on top of Apache's HttpClient libraries.",Java,10622,4051,2011-02-20T03:25:07Z,2026-03-20T05:00:39Z,119,978
resilience4j/resilience4j,resilience4j,https://github.com/resilience4j/resilience4j,Resilience4j is a fault tolerance library designed for Java8 and functional programming,Java,10605,1449,2015-06-03T09:21:01Z,2026-03-26T02:51:45Z,251,1045
jeasonlzy/okhttp-OkGo,jeasonlzy,https://github.com/jeasonlzy/okhttp-OkGo,OkGo - 3.0 震撼来袭，该库是基于 Http 协议，封装了 OkHttp 的网络请求框架，比 Retrofit 更简单易用，支持 RxJava，RxJava2，支持自定义缓存，支持批量断点下载管理和批量上传管理功能,Java,10587,2549,2016-01-15T10:35:24Z,2026-03-26T02:38:26Z,463,515
google/auto,google,https://github.com/google/auto,A collection of source code generators for Java.,Java,10557,1211,2013-05-22T21:41:56Z,2026-03-25T16:51:00Z,74,423
Activiti/Activiti,Activiti,https://github.com/Activiti/Activiti,"Activiti is a light-weight workflow and Business Process Management (BPM) Platform targeted at business people, developers and system admins. Its core is a super-fast and rock-solid BPMN 2 process engine for Java. It's open-source and distributed under the Apache license. Activiti runs in any Java application, on a server, on a cluster or in the cloud. It integrates perfectly with Spring, it is extremely lightweight and based on simple concepts. ",Java,10519,6943,2012-09-13T11:34:43Z,2026-03-25T04:52:01Z,565,1866
lipangit/JiaoZiVideoPlayer,lipangit,https://github.com/lipangit/JiaoZiVideoPlayer,MediaPlayer exoplayer ijkplayer ffmpeg,Java,10504,2442,2016-02-06T11:04:24Z,2026-03-26T01:59:37Z,268,2394
signalapp/Signal-Server,signalapp,https://github.com/signalapp/Signal-Server,"Server supporting the Signal Private Messenger applications on Android, Desktop, and iOS",Java,10458,2442,2013-12-09T07:10:36Z,2026-03-26T01:22:14Z,0,0
tbruyelle/RxPermissions,tbruyelle,https://github.com/tbruyelle/RxPermissions,Android runtime permissions powered by RxJava2,Java,10441,1384,2015-09-29T13:55:09Z,2026-03-24T10:16:58Z,91,196
awsdocs/aws-doc-sdk-examples,awsdocs,https://github.com/awsdocs/aws-doc-sdk-examples,"Welcome to the AWS Code Examples Repository.  This repo contains code examples used in the AWS documentation, AWS SDK Developer Guides, and more. For more information, see the Readme.md file below.",Java,10384,5847,2016-08-18T19:06:57Z,2026-03-25T12:21:04Z,140,2234
SonarSource/sonarqube,SonarSource,https://github.com/SonarSource/sonarqube,Continuous Inspection,Java,10364,2172,2011-01-05T11:05:17Z,2026-03-25T20:15:32Z,0,0
JessYanCoding/MVPArms,JessYanCoding,https://github.com/JessYanCoding/MVPArms,"⚔️ A common architecture for Android applications developing based on MVP, integrates many open source projects, to make your developing quicker and easier (一个整合了大量主流开源项目高度可配置化的 Android MVP 快速集成框架). ",Java,10275,2363,2016-08-06T08:49:56Z,2026-03-24T15:09:49Z,48,281
JingMatrix/LSPosed,JingMatrix,https://github.com/JingMatrix/LSPosed,LSPosed Framework resuscitated,Java,10259,648,2023-07-20T18:03:30Z,2026-03-26T03:09:42Z,31,217
ZCShou/GoGoGo,ZCShou,https://github.com/ZCShou/GoGoGo,一个基于 Android 调试 API + 百度地图实现的虚拟定位工具，并且同时实现了一个可以自由移动的摇杆,Java,10122,1158,2021-12-03T06:59:39Z,2026-03-26T03:18:16Z,1,135
JakeWharton/ViewPagerIndicator,JakeWharton,https://github.com/JakeWharton/ViewPagerIndicator,Paging indicator widgets compatible with the ViewPager from the Android Support Library and ActionBarSherlock.,Java,10086,3954,2011-08-04T17:13:44Z,2026-03-25T02:53:49Z,135,146
stanfordnlp/CoreNLP,stanfordnlp,https://github.com/stanfordnlp/CoreNLP,"CoreNLP: A Java suite of core NLP tools for tokenization, sentence segmentation, NER, parsing, coreference, sentiment analysis, etc.",Java,10063,2718,2013-06-27T21:13:49Z,2026-03-25T16:06:58Z,181,953
happydog-intj/JsBridge,happydog-intj,https://github.com/happydog-intj/JsBridge,"android java and javascript bridge, inspired by wechat webview jsbridge",Java,9930,2012,2015-02-26T12:10:58Z,2026-03-26T03:23:22Z,142,96
xuchengsheng/spring-reading,xuchengsheng,https://github.com/xuchengsheng/spring-reading,涵盖了 Spring 框架的核心概念和关键功能，包括控制反转（IOC）容器的使用，面向切面编程（AOP）的原理与实践，事务管理的方式与实现，Spring MVC 的流程与控制器工作机制，以及 Spring 中数据访问、安全、Boot 自动配置等方面的深入研究。此外，它还包含了 Spring 事件机制的应用、高级主题如缓存抽象和响应式编程，以及对 Spring 源码的编程风格与设计模式的深入探讨。,Java,9929,1257,2023-09-15T06:42:44Z,2026-03-25T14:45:35Z,30,2
wasabeef/glide-transformations,wasabeef,https://github.com/wasabeef/glide-transformations,An Android transformation library providing a variety of image transformations for Glide.,Java,9911,1405,2015-01-09T10:33:29Z,2026-03-26T03:22:28Z,52,105
googlesamples/easypermissions,googlesamples,https://github.com/googlesamples/easypermissions,Simplify Android M system permissions,Java,9899,1463,2015-12-22T18:05:53Z,2026-03-25T12:22:35Z,36,205
paascloud/paascloud-master,paascloud,https://github.com/paascloud/paascloud-master,spring cloud + vue + oAuth2.0全家桶实战，前后端分离模拟商城，完整的购物流程、后端运营平台，可以实现快速搭建企业级微服务项目。支持微信登录等三方登录。,Java,9886,4259,2018-03-17T05:40:43Z,2026-03-23T14:06:32Z,83,42
hackware1993/MagicIndicator,hackware1993,https://github.com/hackware1993/MagicIndicator,"A powerful, customizable and extensible ViewPager indicator framework. As the best alternative of ViewPagerIndicator, TabLayout and PagerSlidingTabStrip   ——   强大、可定制、易扩展的 ViewPager 指示器框架。是ViewPagerIndicator、TabLayout、PagerSlidingTabStrip的最佳替代品。支持角标，更支持在非ViewPager场景下使用（使用hide()、show()切换Fragment或使用setVisibility切换FrameLayout里的View等），http://www.jianshu.com/p/f3022211821c",Java,9813,1553,2016-06-26T08:20:43Z,2026-03-24T15:54:57Z,186,102
OpenFeign/feign,OpenFeign,https://github.com/OpenFeign/feign,Feign makes writing java http clients easier,Java,9787,1938,2013-06-26T23:28:16Z,2026-03-23T11:12:03Z,228,860
HarlonWang/AVLoadingIndicatorView,HarlonWang,https://github.com/HarlonWang/AVLoadingIndicatorView,DEPRECATED,Java,9779,1878,2015-10-24T20:18:33Z,2026-03-26T03:23:18Z,67,38
lihengming/spring-boot-api-project-seed,lihengming,https://github.com/lihengming/spring-boot-api-project-seed,:seedling::rocket:一个基于Spring Boot & MyBatis的种子项目，用于快速构建中小型API、RESTful API项目~,Java,9714,3750,2017-06-23T10:06:30Z,2026-03-25T07:57:57Z,93,105
spinnaker/spinnaker,spinnaker,https://github.com/spinnaker/spinnaker,"Spinnaker is an open source, multi-cloud continuous delivery platform for releasing software changes with high velocity and confidence.",Java,9708,1259,2014-07-02T19:02:36Z,2026-03-26T02:37:12Z,114,5407
YoKeyword/Fragmentation,YoKeyword,https://github.com/YoKeyword/Fragmentation,[DEPRECATED] A powerful library that manage Fragment for Android,Java,9707,2102,2016-02-23T08:54:55Z,2026-03-26T03:19:48Z,189,1034
apache/cassandra,apache,https://github.com/apache/cassandra,Apache Cassandra®,Java,9676,3855,2009-05-21T02:10:09Z,2026-03-25T09:37:46Z,0,0
perwendel/spark,perwendel,https://github.com/perwendel/spark,A simple expressive web framework for java. Spark has a kotlin DSL https://github.com/perwendel/spark-kotlin,Java,9664,1568,2011-05-05T11:52:05Z,2026-03-20T03:33:06Z,204,551
koral--/android-gif-drawable,koral--,https://github.com/koral--/android-gif-drawable,Views and Drawable for displaying animated GIFs on Android,Java,9661,1789,2013-01-30T01:37:46Z,2026-03-25T22:37:30Z,32,662
react-native-camera/react-native-camera,react-native-camera,https://github.com/react-native-camera/react-native-camera,A Camera component for React Native. Also supports barcode scanning!,Java,9648,3540,2015-04-01T00:54:40Z,2026-03-24T09:23:42Z,73,2307
ksoichiro/Android-ObservableScrollView,ksoichiro,https://github.com/ksoichiro/Android-ObservableScrollView,Android library to observe scroll events on scrollable views.,Java,9626,2048,2014-11-08T14:45:20Z,2026-03-23T15:43:31Z,175,89
AutoMQ/automq,AutoMQ,https://github.com/AutoMQ/automq,AutoMQ is a diskless Kafka® on S3. 10x Cost-Effective. No Cross-AZ Traffic Cost. Autoscale in seconds. Single-digit ms latency. Multi-AZ Availability.,Java,9624,675,2023-08-17T07:50:13Z,2026-03-25T23:46:24Z,59,538
flyway/flyway,flyway,https://github.com/flyway/flyway,Flyway by Redgate • Database Migrations Made Easy.,Java,9620,1605,2012-12-14T18:43:22Z,2026-03-25T19:26:31Z,217,3371
bilibili/DanmakuFlameMaster,bilibili,https://github.com/bilibili/DanmakuFlameMaster,Android开源弹幕引擎·烈焰弹幕使 ～,Java,9613,2113,2013-08-11T12:18:50Z,2026-03-25T12:53:33Z,256,155
seven332/EhViewer,seven332,https://github.com/seven332/EhViewer,[DEPRECATED] An Unofficial E-Hentai Application for Android,Java,9550,944,2014-05-14T12:03:52Z,2026-03-26T01:04:52Z,194,400
MyCATApache/Mycat-Server,MyCATApache,https://github.com/MyCATApache/Mycat-Server,,Java,9544,3824,2014-12-04T02:46:54Z,2026-03-25T02:10:10Z,934,791
liaohuqiu/android-Ultra-Pull-To-Refresh,liaohuqiu,https://github.com/liaohuqiu/android-Ultra-Pull-To-Refresh,Ultra Pull to Refresh for Android. Support all the views.,Java,9531,2641,2014-11-13T03:13:10Z,2026-03-26T03:23:42Z,150,146
crossoverJie/cim,crossoverJie,https://github.com/crossoverJie/cim,📲cim(cross IM) 适用于开发者的分布式即时通讯系统,Java,9490,2875,2018-05-20T15:55:56Z,2026-03-25T08:24:37Z,37,60
umano/AndroidSlidingUpPanel,umano,https://github.com/umano/AndroidSlidingUpPanel,This library provides a simple way to add a draggable sliding up panel (popularized by Google Music and Google Maps) to your Android application. Brought to you by Umano.,Java,9484,2242,2013-05-31T18:33:53Z,2026-03-15T02:59:23Z,267,562
spring-projects/spring-security,spring-projects,https://github.com/spring-projects/spring-security,Spring Security,Java,9474,6249,2012-01-10T21:50:57Z,2026-03-26T02:14:45Z,1184,12467
opendataloader-project/opendataloader-pdf,opendataloader-project,https://github.com/opendataloader-project/opendataloader-pdf,PDF Parser for AI-ready data. Automate PDF accessibility. Open-source.,Java,9439,696,2025-05-13T05:48:02Z,2026-03-26T03:23:57Z,15,67
Justson/AgentWeb,Justson,https://github.com/Justson/AgentWeb, AgentWeb is a powerful library based on Android WebView.,Java,9411,1662,2017-05-12T07:45:56Z,2026-03-24T15:54:56Z,88,962
json-path/JsonPath,json-path,https://github.com/json-path/JsonPath,Java JsonPath implementation,Java,9394,1715,2011-01-24T13:19:19Z,2026-03-25T23:07:25Z,349,320
pockethub/PocketHub,pockethub,https://github.com/pockethub/PocketHub,PocketHub Android App,Java,9380,3423,2011-09-08T16:52:50Z,2026-03-18T11:31:33Z,132,538
huanghaibin-dev/CalendarView,huanghaibin-dev,https://github.com/huanghaibin-dev/CalendarView,"RecyclerView? ListView or ViewGroup? No, it's Canvas! Ultra performance and free customization interface! Vertical and horizontal, Fast rendering and extremely low memory.  Android上一个优雅、万能自定义UI、仿iOS、自定义动画，支持垂直、水平方向切换、支持周视图、自定义周起始、性能高效的日历控件，热插拔实现UI定制！Canvas绘制，渲染速度快、占用内存低，你真的想不到日历居然还可以如此优雅。",Java,9370,1846,2017-03-11T07:16:09Z,2026-03-25T05:46:31Z,450,375
GcsSloop/AndroidNote,GcsSloop,https://github.com/GcsSloop/AndroidNote,安卓学习笔记,Java,9340,2145,2016-01-04T23:51:36Z,2026-03-26T02:35:00Z,49,52
android/testing-samples,android,https://github.com/android/testing-samples,A collection of samples demonstrating different frameworks and techniques for automated testing,Java,9302,3646,2014-10-11T03:51:27Z,2026-03-25T12:20:24Z,84,153
apache/jmeter,apache,https://github.com/apache/jmeter,Apache JMeter open-source load testing tool for analyzing and measuring the performance of a variety of services,Java,9291,2273,2010-05-26T23:38:07Z,2026-03-25T18:11:14Z,883,4542
apache/seatunnel,apache,https://github.com/apache/seatunnel,"SeaTunnel is a multimodal, high-performance, distributed, massive data integration tool.",Java,9202,2203,2017-08-05T09:14:47Z,2026-03-26T01:36:55Z,334,4201
cats-oss/android-gpuimage,cats-oss,https://github.com/cats-oss/android-gpuimage,Android filters based on OpenGL (idea from GPUImage for iOS),Java,9158,2305,2012-10-04T08:11:58Z,2026-03-25T13:15:19Z,333,87
flowable/flowable-engine,flowable,https://github.com/flowable/flowable-engine,"A compact and highly efficient workflow and Business Process Management (BPM) platform for developers, system admins and business users.",Java,9143,2820,2016-10-13T07:21:43Z,2026-03-25T23:53:50Z,356,1037
didi/VirtualAPK,didi,https://github.com/didi/VirtualAPK,A powerful and lightweight plugin framework for Android,Java,9066,1537,2017-06-29T07:25:05Z,2026-03-21T01:59:48Z,115,245
HMCL-dev/HMCL,HMCL-dev,https://github.com/HMCL-dev/HMCL,"A Minecraft Launcher which is multi-functional, cross-platform and popular",Java,9007,847,2015-06-22T08:06:03Z,2026-03-26T00:17:51Z,340,2653
KunMinX/Jetpack-MVVM-Best-Practice,KunMinX,https://github.com/KunMinX/Jetpack-MVVM-Best-Practice,"难得一见 Jetpack MVVM 最佳实践。在 ""以简驭繁"" 代码中，对 ""视图控制器"" 乃至 ""标准化开发模式"" 形成正确、深入理解。",Java,8951,1651,2019-10-31T05:21:01Z,2026-03-23T07:29:35Z,3,58
navasmdc/MaterialDesignLibrary,navasmdc,https://github.com/navasmdc/MaterialDesignLibrary,This is a library with components of Android L to you use in android 2.2,Java,8944,2201,2014-09-30T07:37:17Z,2026-03-25T16:07:12Z,211,125
alibaba/spring-ai-alibaba,alibaba,https://github.com/alibaba/spring-ai-alibaba,Agentic AI Framework for Java Developers,Java,8937,1971,2024-09-09T01:35:50Z,2026-03-26T03:06:00Z,317,1355
Freelander/Android_Data,Freelander,https://github.com/Freelander/Android_Data,"Some Android learning materials, hoping to help you learn Android development.",Java,8916,2024,2015-04-04T01:37:44Z,2026-03-24T20:50:04Z,2,5
LSPosed/LSPatch,LSPosed,https://github.com/LSPosed/LSPatch,LSPatch: A non-root Xposed framework extending from LSPosed,Java,8908,1071,2021-03-01T19:38:36Z,2026-03-26T00:50:41Z,12,128
java-native-access/jna,java-native-access,https://github.com/java-native-access/jna,Java Native Access,Java,8907,1682,2011-04-29T13:30:29Z,2026-03-24T23:53:56Z,102,732
checkstyle/checkstyle,checkstyle,https://github.com/checkstyle/checkstyle,"Checkstyle is a development tool to help programmers write Java code that adheres to a coding standard. By default it supports the Google Java Style Guide and Sun Code Conventions, but is highly configurable. It can be invoked with an ANT task and a command line program.",Java,8903,4074,2013-08-31T02:05:05Z,2026-03-26T02:01:39Z,796,5166
frohoff/ysoserial,frohoff,https://github.com/frohoff/ysoserial,A proof-of-concept tool for generating payloads that exploit unsafe Java object deserialization.,Java,8824,1856,2015-01-28T07:13:55Z,2026-03-25T20:20:07Z,25,83
karatelabs/karate,karatelabs,https://github.com/karatelabs/karate,Test Automation Made Simple,Java,8813,2022,2017-02-07T15:59:17Z,2026-03-25T21:42:24Z,59,2108
PojavLauncherTeam/PojavLauncher,PojavLauncherTeam,https://github.com/PojavLauncherTeam/PojavLauncher,A Minecraft: Java Edition Launcher for Android and iOS based on Boardwalk. Succeeded by https://github.com/AngelAuraMC/Amethyst-Android,Java,8803,1905,2020-03-11T03:22:54Z,2026-03-25T15:25:00Z,112,6041
nathanmarz/storm,nathanmarz,https://github.com/nathanmarz/storm,"Distributed and fault-tolerant realtime computation: stream processing, continuous computation, distributed RPC, and more",Java,8789,1651,2011-09-17T07:55:13Z,2026-03-23T12:03:22Z,0,0
apache/shenyu,apache,https://github.com/apache/shenyu,"Apache ShenYu is a Java native API Gateway for service proxy, protocol conversion and API governance.",Java,8782,3035,2018-07-11T08:17:45Z,2026-03-25T04:12:19Z,146,2298
laobie/StatusBarUtil,laobie,https://github.com/laobie/StatusBarUtil,A util for setting status bar style on Android App.,Java,8771,1714,2016-02-15T03:06:06Z,2026-03-26T02:39:22Z,109,179
cabaletta/baritone,cabaletta,https://github.com/cabaletta/baritone,google maps for block game,Java,8759,1807,2018-08-01T15:34:21Z,2026-03-25T15:49:22Z,859,3339
Blankj/awesome-java-leetcode,Blankj,https://github.com/Blankj/awesome-java-leetcode,:crown: LeetCode of algorithms with java solution(updating).,Java,8737,1704,2017-04-17T15:51:41Z,2026-03-25T15:42:40Z,5,21
chrisbanes/Android-PullToRefresh,chrisbanes,https://github.com/chrisbanes/Android-PullToRefresh,DEPRECATED,Java,8665,4650,2011-11-29T09:59:56Z,2026-03-20T05:00:36Z,0,0
apache/iceberg,apache,https://github.com/apache/iceberg,Apache Iceberg,Java,8663,3103,2018-11-19T16:26:46Z,2026-03-26T02:59:10Z,364,4191
ybq/Android-SpinKit,ybq,https://github.com/ybq/Android-SpinKit,Android  loading animations,Java,8653,1319,2016-03-20T08:40:51Z,2026-03-26T02:39:46Z,60,21
amitshekhariitbhu/Android-Debug-Database,amitshekhariitbhu,https://github.com/amitshekhariitbhu/Android-Debug-Database,A library for debugging android databases and shared preferences - Make Debugging Great Again,Java,8645,881,2016-11-16T14:20:24Z,2026-03-24T20:50:00Z,74,106
react-native-image-picker/react-native-image-picker,react-native-image-picker,https://github.com/react-native-image-picker/react-native-image-picker,:sunrise_over_mountains: A React Native module that allows you to use native UI to select media from the device library or directly from the camera.,Java,8637,2086,2015-06-08T20:25:31Z,2026-03-26T00:41:39Z,300,1403
shwenzhang/AndResGuard,shwenzhang,https://github.com/shwenzhang/AndResGuard,proguard resource for Android  by wechat team,Java,8634,1550,2015-10-11T11:48:06Z,2026-03-24T15:09:45Z,160,313
testcontainers/testcontainers-java,testcontainers,https://github.com/testcontainers/testcontainers-java,"Testcontainers is a Java library that supports JUnit tests, providing lightweight, throwaway instances of common databases, Selenium web browsers, or anything else that can run in a Docker container.",Java,8615,1812,2015-04-12T12:44:59Z,2026-03-26T01:44:16Z,403,2019
dropwizard/dropwizard,dropwizard,https://github.com/dropwizard/dropwizard,A damn simple library for building production-ready RESTful web services.,Java,8603,3419,2011-01-19T19:52:29Z,2026-03-25T21:53:29Z,19,1607
airbnb/epoxy,airbnb,https://github.com/airbnb/epoxy,Epoxy is an Android library for building complex screens in a RecyclerView,Java,8571,734,2016-08-08T23:05:11Z,2026-03-25T18:33:22Z,299,594
